review_title,review_date,review_person,ratings,review_text,review_text_pro,review_text_con
Better Employment,2017-11-14,Anonymous Employee,4,,"Great office culture of work-life balance. This includes flexibility, understanding, and compassion. Management is made of real people that take into consideration that employees are also real people with real life issues outside of work sometimes. Plenty of office events, celebrations, and activities to keep us happy and motivated. Lots of things going on to remind us what a great service we are building. An environment is curated here that you feel heard, that your ideas amount to something, and the work you put in directly affects the platform.","When it rains, it pours. This isn't about BetterHelp specifically, but just start ups in general. When we're busy, we're really busy, meaning sometimes we work some long days/evenings. It gets really cold in the office sometimes."
Awesome place for providing help to those who need it,2017-04-01,,5,,"1. Compared to other platforms, BetterHelp has the most options for any kind of expertise and service offered.  2. It's the most robust (and oldest?) player in the market which is very assuring when working in the mental health field.","1. The platform is constantly changing which often creates confusion and concerns among providers. 2. While pay is fair, it still doesn't compare to private practice rates."
"Important mission, impactful work and good culture",2019-08-29,"Employee in Sunnyvale, CA",5,,"Company has a great mission and really helps a lot of people. It's obvious from all the reviews that come in. Company also has a fun and friendly culture with great people. If you are self motivated and ok with fast pace and less structure, you can do very well.","Feels like a startup without a lot of structure which can be hard for some people. Depending on your role, it can sometimes be hard to know if you are doing well."
Changing the world one person at a time.,2017-11-13,"Anonymous Employee in Sunnyvale, CA",5,,"When I tell stories to my relatives and friends working outside silicon valley they can't believe a place like this exists. Betterhelp bends over backwards to foster community and keep it's exceptionally skilled team intact and pushing forward toward it's lofty goals. This small but close knit group has accomplished more in the past year than competitors 10x our size and we have made meaningful impacts in countless peoples lives as a result of the platform and network of professionals we've developed. This is the place where you can have a real impact and grow both professionally and personally. The work is challenging and there are moments of high stress but they are tempered with recognition and accomplishment in a balanced way. We get free lunches daily, free door dash if you are working late, we have hammocks and massage chairs, a $2000 coffeemaker and all Chromatic coffee you can drink, beers are in the fridge, the break room snacks are never lacking and so long as you get your work done no one seems to care about the specific hours you are at your fancy standing desk. It's a fantastic company and you will be lucky if you make through rigorous interview process and onto the team. It's worth the effort.","You have to be a self starter. If you are someone that needs to wait to be told what and how to do things, then this is not the place for you."
Enjoy getting up and going into the office again!,2017-11-13,Anonymous Employee,5,,-Amazing location (close to freeways/has Caltrain shuttle option)  -Super friendly work environment (also dog-friendly!!) -Office kitchen always has your favorite snacks in stock  -Growing company with the opportunity to make an impact and share your ideas -Focus on health and wellness in an office environment  -Work/life balance with frequent team bonding outings,"- everyone works hard so this won't be a good fit if you tend to blend in and slack, everyone pulls their weight and contributes to the team everyday -sometimes the weather is bad so you have to sit inside and watch Tv with the company during lunch hour instead of sitting in the sunshine"
Community Support Manager Review,2019-09-19,Community Support Manager,4,,"-Team is super open minded, helpful and supportive -Work culture promotes growth within the individual and also to the company -Operations team is ALWAYS so helpful and supportive  -Great office perks!","-A lot of workload, super busy and fast paced environment"
"Leaders who care, good work with perks",2019-10-09,Community Support Manager,5,,"Great team environment, everybody works to achieve goals Feel there is thought and effort to help me develop, I can see myself grow here! Like my manager, they listen to feedback and work to develop solutions to concerns Awesome perks, fully stocked kitchen Lunch everyday","Still understaffed, I know the team is working to fix this! Wish we had more standardized approaches, it's still a start-up and how to handle customer questions is sometimes unclear. I'm confident this will also improve."
Great!,2017-02-10,"Senior Software Engineer in Sunnyvale, CA",5,,"- Feels awesome to use my engineering skills to build software that saves lives every day. - Any software or hardware you want, boom, it's there! - Great compensation and perks (insurance, free meals every day, awesome modern office space, etc...). - The best work/life balance I've had all my career.","It's a startup, so if you can't deal with super fast pace and lots of changes, don't come here."
Great place for self-starters,2017-02-10,Anonymous Employee,5,,"BetterHelp's management style is very light touch. If you hate being micromanaged and have the self discipline to see a project through from start to finish, and really enjoy taking ownership over projects and ideas, this is the perfect environment.","If you are the type of person who needs lots of structure and guidance, you will not do well here."
Anonymous,2017-12-18,"Anonymous in Sunnyvale, CA",4,,"Mostly fun/social place to work, incredible office manager that gives the environment more energy than you'd expect. Excellent perks, benefits, 401k, free GOOD lunches everyday.","Numbers/Data hold precedent to everything else, although you can work/explore other departments but not a ton of upward mobility"
Highly recommend!,2020-06-19,Anonymous Employee,5,,"Great team culture Supportive Management Plenty of opportunities if you’re looking to grow, or be able to share your ideas and feel heard If there’s something you need to make your job easier/ more comfortable, they’ll provide it","Company is growing at a fast pace, and with that there is room for improvement in the structure for trainings, but it’s moving in the right direction"
Fulfilling yet fun place to work,2019-08-28,"Anonymous in Sunnyvale, CA",5,,"Great company culture, challenging projects, positive company mission, opportunity to be hands on with aspects of the company outside your department, good benefits, get to experience the start up atmosphere while having the security of an established parent company","Some growing pains as the company grows, goals not always clear and defined, communication between teams not always the best"
It was a pleasant experience,2017-09-12,Anonymous Employee,5,,1) Small company means as an individual you have a lot to contribute directly. 2) Provides free lunch 3) Surrounded by smart coworkers 4) It's in the Bay Area 5) Competitive pay,1) This job can be demanding 2) Sometimes have to work during vacation time
BetterHelp promotes wonderful office culture!,2017-05-01,Junior Data Analyst,5,,"Everyone is super friendly. We all eat lunch together, support each others projects, and make sure the office stays lively. People are able to make serious contributions to the company and feel like what they do matters.",Open concept office- though I see this as a major plus.
Great company with an amazing culture,2020-01-07,Software Developer,5,,"Great benefits, lunch provided, lots of fun events and working for a company promoting metal health care","None, great place to work!"
Awesome place to work,2017-05-01,"Software Engineer in Sunnyvale, CA",4,,"Great team, benefits, and work environment. Free lunch, company outings, equipment of your choice, friendly coworkers.",Doesn't seem to be much opportunity for career advancement
Satisfying place to work,2019-08-28,"Software Developer in Sunnyvale, CA",5,,- Great compensation and benefits - Impactful product - Great team culture - Opportunities for professional growth,"- Older technology (PHP, jQuery, MySQL), but that is changing as the company grows"
Great place to work!,2017-11-13,Community and Support Administrative Associate,5,,Great work environment. Everyone here is very friendly and great to work with. It makes coming in to work fun!,There are no cons to working here!
Startup feel with public company resources,2019-08-28,"Marketing in Sunnyvale, CA",5,,"Flexibility, ease of access to different teams, freedom within your role, opportunity to progress and learn.",Hiring can take a long time.
Great people with an important mission,2020-06-17,Anonymous Employee,5,,"Fun people to work with, Meaningful work helping people get therapy, challenging projects","No cons, it's a great place to work"
Great place to work,2019-12-05,Community Support Manager,5,,Great place to work! Wonderful company culture and the CEO and managers like to promote from within,Not many cons! Great place
Supportive and Transparent,2020-06-17,Marketing,5,,-great company culture -good perks -amazing coworkers -mission driven company,-sometimes can be too data driven
Great employee support,2020-06-29,"Support in Mountain View, CA",4,,"Great community, free lunch, great business mission",Work days can be long at times
Betterhelp pros and cos,2023-03-21,"Online Counsellor in London, England",4,,BetterHelp provide you the counsellor with online clients who complete a brief summary of why they are seeking help. You are given a schedule to update with times available. Contact with the client is made through the BetterHelp portal and you can send text messages as well. Payment is made on a Wednesday for the previous week’s work.,"You do feel you are working in a vacuum. No idea how much the client is paying. You cannot book a session at short notice, like the same day. I offer 20 or more hours of available slots, but only have 5 or 6 clients. I am paid about £20 each session – that is 45 minutes online, write up time for notes, preparation and if a client DNA you are not paid. Then you get a message to say Client X is no longer a subscriber. What does that mean? They did not like you, they felt fully recovered, maybe they went to another BetterHelp counsellor."
Overall enjoyed,2023-04-30,"Administrative in London, England",4,,enjoyed working environment day to day,could be better support from higher level
it was a pleasant experience,2023-04-01,Psychologist,5,,An agency that is kind to its clients and takes care of their problems in detail.,working with psychologists with different experiences
