review_title,review_date,review_person,ratings,review_text,review_text_pro,review_text_con
A very unique environment,2013-06-29,"Program Officer in Seattle, WA",4,,"Opportunities to learn every day, exposure to the best and brightest in the staff and the people the Foundation brings in to collaborate, awesome mission, beautiful campus, culture of continuous improvement",On occasion the egos and politics can get to be a bit much. A relatively young organization still working on its internal processes
"Mission is good, the leadership is bad",2016-09-11,"in Seattle, WA",1,,Benefits are top notch. Salary is somewhat comparable. The backbone and passion lies in the people and the grant makers.,"The challenge is that operations departments like HR and IT are run by egocentric people. If you look at these leaders, they are more interested in gettign an article in a magazine, working on fluff projects, and speaking to industry people, than actually running their operational teams. It is amazing how much money gets spent internally on remodeling for a ""better IT"" experience, instead of funding grants. In the programs you have the presidents doing pretty much whatever they want, so there is no congruity in the process and how money gets spent in this organization."
Excellent Company,2017-08-10,"Program Assistant in Seattle, WA",5,,"The mission, the BENEFITS, the travel, and the people - it is an amazing place to work.",Most people in administrative roles are over qualified for their job. There isn't a clear career path at the organization.
"Great benefits, smart people, limited by reorgs",2020-02-13,"Legal Assistant in Seattle, WA",4,,"Benefits, beautiful office environment, Seattle location closes for week in December, onsite gym","Constant reorgs, no room for growth, lots of bureaucracy and politics, meeting culture and all decisions made by committee, which slows progress and waters down ideas"
Challenging and great learning experience,2011-02-25,"Program Assistant in Seattle, WA",4,,You contribute to society at large in a big way by supporting their work Selective employment process = smart co-workers challenging and fast paced,"Very flat organization, difficult to move up or get promoted from within."
Great place to learn and grow,2016-11-11,"Summer Intern in Seattle, WA",5,,"You get the opportunity to work with smart, passionate people to solve some of the world's biggest problems. Great ""campus"" feel in Seattle--I felt proud walking in to work every day","Feels very siloed--at a big organization, hard for all the teams and departments to talk to each other. Also, some people seem kind of complacent in their roles; you might not necessarily get a fast-paced startup feel here at such a big, bureaucratic nonprofit, but it varies based on what team you're on."
"Great mission, great people, challenging org politics",2018-05-03,"Anonymous Employee in Seattle, WA",3,,People are kind and are there for a purpose; mission is very inspiring,"It is really hard to get things done; norm of consensus decision making means everyone gets to weigh in on everything; program areas have all the power, operations teams are second class citizens"
"Not Dream-like, not the worst",2015-05-07,"Anonymous Employee in Seattle, WA",3,,A lot of opportunity for continuing education. Tons of amazing speakers that you could not see anywhere else. Being part of a great mission.,many poor managers. divide between program and operational staff creates a lack of respect for operational staff. lack of big picture planning. Siloed roles. Lack of interaction with cross org groups.
Don't waste your time,2010-03-29,"in Seattle, WA",1,,"Mission, Great medical benefits and retirement, interesting guest speakers who are famous, free food, convenient location, great Xmas party and summer picnic.",Don't expect the right things to get done and don't expect skilled management. Management here leaves little to be desired. Not only are they incapable of basic management tasks they have no idea of the technology they manage. Think Lord of the Flies live daily.  Management does not support their direct reports either professionally or personally. Work/life balance could be improved if processes were improved. Avoid interacting with the Director of Computing and Network Operations and Network Services Manager.
Internal processes and politics are THE top priorities at the foundation,2012-03-07,"Program Officer in Seattle, WA",1,,"- Positive mission statement, was started by people who's hearts were in the right place - Huge economic stimulus to the nonprofit and NGO sectors and the agencies/firms/consultants that support them - Get to meet and network with top leaders from the political, NGO, entertainment, and science worlds  - Huge budgets: if you can dream it and marshal the political will behind it, you can do it - Generous retirement contributions - Can score a free lunch most days due to large number of lunchtime meetings - West coast office hours - everyone is gone by 5:30pm (but you will still have to work from home) - Nice new campus, they make it easy to bike to work even during the rainy months","The Bottom Line: You need to bring your political A-game if you want to survive here.   The Organization:  It's common to hear ""this place is like a startup"". It is in some ways. Unfortunately, the more positive aspects of startup culture are not represented here. In a startup people tend to rally behind the mission and all pull together to accomplish goals. Success is interdependent at a startup.   Just the opposite is true at the foundation. It's very much a zero-sum game and success is not conceived of as being mutual. Turf wars abound between teams and within teams; struggling for attention/blessing from the highest levels of foundation leadership, funding for their projects, team headcount, and media coverage. This creates a lot of enmity between people and teams, the greatest casualties are the great ideas that never come to fruition and missed opportunities. Being a team player is not on anyone's annual goals.  The organization is constantly reorganizing. This creates a lot of uncertainty for projects, issues and the people who work on them. Twelve to eighteen months between major reorganizations is about the norm, shorter for more minor reorgs. Leadership can't seem stick with one operating model long enough to thoroughly vet it before moving on to the next thing. ""Top tier"" management consulting companies have deeply embedded themselves at the foundation and attached themselves to influential leaders. These management consultants are very effective at triggering reorganizations which result in a big payday for them.    The Leadership:  The incentive is to ""manage up"" rather than manage across or down. Without a good boss/mentor/champion behind you, it's very difficult if not impossible to advance your career here. Very few people are lucky enough to find someone who wants to pull them up.  There is little to no emphasis on working together better. After an internal analysis revealed a level of dissatisfaction around the culture and how people worked together, a senior leader was asked what was being done to improve the situation. This leader indicated to the staff that those are not the metrics that leadership is focused on.    The Work:  The public perception may be that the foundation is a fulfilling place to work because of all the good it does. The reality is quite different. The foundation is essentially a checkbook and as an everyday employee you are many layers away from the work being performed on the ground by sub-sub-sub-sub-contractors. Additionally, the foundation's grantees and vendors charge what is known as ""Gates rates"". Almost every request for funding or contract is significantly inflated. It's often disheartening to see so much of the budget be eaten up by inflated expenses.  The foundation tends to work with the same set of ""partners"" who have become entrenched interests at the foundation. There's very little appetite or ability to solicit fresh new ideas from hungry, smaller partners. In the case of these large entrenched, and often highly entitled, partners, the relationships have become dysfunctional - more about the money than the good work.  Strategy refreshes for issues are frequent, intense and can take upwards of 5 months to complete. This prevents the real work from being done on the ground. Supporting these strategy refreshes is another huge stream of money for ""top tier"" management consulting firms working at the foundation.   The Coworkers:  Cautionary tale: I got thrown under the bus on my third day of employment after being invited out for a ""welcome lunch"" by one of my peers. On the fourth day our group's Business Officer chewed me out because my lunch-mate from the previous day had reported me and intentionally misrepresented what I said. You never know who you can really trust.  People from the northwest tend to be pretty frosty and passive aggressive, but the folks here take it to a whole new level. Feeling completely alone in a building of 800+ people was common.  Unfortunately, the lower you are on the totem pole, the tougher it is. The lowest level employees, the Program Assistants and Program Coordinators have it the worst. The treatment they received from higher ups was often thoughtless as if they were lesser humans and sometimes bordered on abusive. Many people who are Senior Program Officers and above demand to be waited on hand and foot. Example: many of them don't know how or refuse to print their own documents.   HR is completely ineffective. They will always take the side of the higher ranking employee. Staying out of the cross hairs of others is your best and probably only defense."
It's all about the manager,2015-09-02,"Program Officer in Seattle, WA",3,,"Ridiculously good benefits, beautiful campus, frequent high-profile visitors","When there is a management issue, it is virtually impossible to get it addressed regardless of the route you take to deal with it. If you make too much noise about it, you become the problem."
All lives do not have equal value,2018-03-01,"Senior Program Assistant in Seattle, WA",3,,Great place to work for it’s name caché. Amazing benefits. You’re surrounded by smart people.,Bureaucracy at it’s worst. Not a nimble or adaptable organization. The phrase navel gazing comes to mind. Limited upward career mobility.
Mission Possible,2018-03-10,"Senior Project Manager in Seattle, WA",5,,"Mission, vision, and strategy for their giving is clear.",Mission and vision for internal process could be improved
Senior Program Officer,2016-01-09,"Senior Program Officer in Washington, DC",2,,"Sharp colleagues. Most ventures are honorable, close-to-the-heart kinds of endeavors. Red carpet everywhere you go to represent the foundation. Great perks.","Little to negative concern for staff, which hampers zest, confidence and innovative thinking."
"Great Benefits, Difficult Culture",2019-09-20,"Senior Communications Officer in Seattle, WA",3,,Great benefits. Smart co-workers. Great offices. Great perks.,Too many systems and processes - most of which folks don't follow. There's little follow up after your initial on boarding. Very corporate DNA. Culture of meeting after meeting - difficult to make decisions or change the way things are done.
Great mission but many missed opportunities,2015-10-17,"Anonymous Employee in Seattle, WA",2,,Mission. Lack of resource constraints typically encountered working for a non-profit. Extraordinary technical (e.g. programmatic) talent (in contrast to surprisingly weak management talent). Great benefits.,"As an organization and ""business"" very badly managed -- from strategy to resource allocation to talent management. This arises from (1) having technical experts in senior management positions, and (2) over-conciliatory, consensus-driven, passive-aggressive culture. Where pockets of true management talent exists, it's highly under-utilized. Management decision-making is undisciplined and political, resulting in sub-optimal results."
Senior Program Officer,2015-11-05,"Senior Program Officer, Global Health in Seattle, WA",2,,"Smart people, endless resources, great compensation and benefits, lots of interesting travel, willingness to take risks.","Too many internal politics and too much bureaucracy. Too much ""stakeholder buy-in"" required to make decisions and move projects forward. Terrible work/life balance. Tons of email and meetings and not enough time to do actual thoughtful work."
Noble Mission - challenging culture,2018-09-05,"Anonymous Employee in Seattle, WA",2,,The inspirational mission and the strategic vision for development that has a real impact.,"The mission does not translate into a culture that promotes real diversity and gets the best from its employees. Working there feels like a transactional experience for many, and in places it tolerates very poor management."
"Great Benefits, Poor Organizational Management",2020-02-20,"Communications Officer in Washington, DC",4,,"great pay, parental leave, unlimited vacation, great health care, flexible work culture","a lot of re-organizations and shifts in strategy, leading to a lot of ambiguity and disorganization, not enough manager training"
"Amazing place to work, if you go in eyes wide open.",2020-01-06,"Senior Program Manager in Seattle, WA",5,,Mission and total compensation is unparalleled,Constant change at every level is difficult for people who don’t work well in those environments.
Thought it was a dream job until...,2015-07-16,"Anonymous Employee in Washington, DC",2,,"Incredible benefits, work environment (if you don't mind open concept offices), state of the art technology, serious passion for the mission.","Ridiculous level of unnecessary internal complexity, politics, and never-ending job justification. Promotes a culture of passive aggressiveness or worse--deliberate back-stabbing behavior. Everyone is hell bent on proving their superior intelligence."
"Great mission, terrible workplace",2020-03-05,"Senior Program Officer in Seattle, WA",1,,"Great benefits, people who are smart yet cutthroat competitive. They will eat you up alive. If you don't leave, then you become one of Them, thereby perpetuating the bad culture b/c the healthy/normal people who really care, end up leaving.","Terrible work culture and environment. Really bad leadership who would be better off being politicians. There is a lot of 'white savior complex,' too, from many of the people who work there."
Executive Office,2015-08-30,"Anonymous Employee in Seattle, WA",4,,BMGF has a great mission - can be very inspiring to contribute. Very talented people to work with.,"They are cultural challenges, somewhat related to the immense scale of the work. Related to that, work domains can be silo'ed. But leadership is working hard to address the issues."
Global Health Program Assistant to Program Officers and Deputy Director,2010-04-20,"Program Assistant in Seattle, WA",3,,"Exceptional talent at mid-level, educated and inspirational people doing fantastic work, stimulating place to work, lots of interesting topics and you will meet a lot of interesting people","Unfortunately, there is increasing beauracracy and the lower level employees, those below Program Officer level, are virtually invisible to management"
Intense,2012-07-24,"Administrative in Seattle, WA",2,,Great learning experience; brilliant people; focused missions and strategies; perfect for the beginning of ones career or at the end of it. Great stepping stone to further ones career.,"No career opportunities; limited positions; too many changes and processes; no real work/life balance at the lower end of the food chain; good stepping stone, but nowhere to go except back to public/private sector."
Easy to lose perspective.,2012-07-26,"Anonymous Employee in Seattle, WA",3,,"The mission and people are inspiring. The wealth of expertise, resources and ability is sometimes staggering.   The building is amazing.","A number of people in management positions are there for their subject matter expertise, not their management skills, which are often lacking. This is not the case broadly, but in pockets.  The focus of upper management is changing how people work, rather than the work itself. This leads to initiative after initiative striving to fix problems that are real."
Life changing,2014-02-26,"Anonymous Employee in Seattle, WA",5,,Great place to work with the best mission of any org always challenging. You learn more about yourself and the world working there. Fantastic people,Lot of politics; lots of Type A personalities
Program Assistant,2015-10-14,"Program Assistant in Laurel, MD",4,,Working alongside of brilliant minds for purpose,No clear path for advancement for most positions.
Information Technology,2016-10-12,"in Seattle, WA",2,,- Benefits - Location - Employee resources,"- Management/Leadership - Culture - Transparency  Zero transparency, always saying the right things but doing the opposite.  High-performing individuals get driven out and low-performing individuals get promoted.   Management is only interested in managing upwards."
"Great mission, great people, challenging org politics",2018-05-03,"Anonymous Employee in Seattle, WA",3,,People are kind and are there for a purpose; mission is very inspiring,"It is really hard to get things done; norm of consensus decision making means everyone gets to weigh in on everything; program areas have all the power, operations teams are second class citizens"
"Great people, great mission",2015-06-04,"Anonymous Employee in Seattle, WA",4,,Smart people Interesting work Travel opportunities Grantee interactions Supportive team,hard to get in the work in 40 hours middle management needs help
Innovative Environment,2015-06-26,"Anonymous Employee in Seattle, WA",4,,"impactful and challenging work, strong community of intelligent colleagues, good work life balance","overly consensus driven - lack of decision making, frustrating processes"
Brilliant people work at the foundation doing amazing work,2012-05-04,"in Seattle, WA",4,,"Mission, Quality of the staff, Seattle Facilities. employee Benefits",Management skills need improvement and work process simplification is needed.
"Not Dream-like, not the worst",2015-05-07,"Anonymous Employee in Seattle, WA",3,,A lot of opportunity for continuing education. Tons of amazing speakers that you could not see anywhere else. Being part of a great mission.,many poor managers. divide between program and operational staff creates a lack of respect for operational staff. lack of big picture planning. Siloed roles. Lack of interaction with cross org groups.
Don't waste your time,2010-03-29,"in Seattle, WA",1,,"Mission, Great medical benefits and retirement, interesting guest speakers who are famous, free food, convenient location, great Xmas party and summer picnic.",Don't expect the right things to get done and don't expect skilled management. Management here leaves little to be desired. Not only are they incapable of basic management tasks they have no idea of the technology they manage. Think Lord of the Flies live daily.  Management does not support their direct reports either professionally or personally. Work/life balance could be improved if processes were improved. Avoid interacting with the Director of Computing and Network Operations and Network Services Manager.
Internal processes and politics are THE top priorities at the foundation,2012-03-07,"Program Officer in Seattle, WA",1,,"- Positive mission statement, was started by people who's hearts were in the right place - Huge economic stimulus to the nonprofit and NGO sectors and the agencies/firms/consultants that support them - Get to meet and network with top leaders from the political, NGO, entertainment, and science worlds  - Huge budgets: if you can dream it and marshal the political will behind it, you can do it - Generous retirement contributions - Can score a free lunch most days due to large number of lunchtime meetings - West coast office hours - everyone is gone by 5:30pm (but you will still have to work from home) - Nice new campus, they make it easy to bike to work even during the rainy months","The Bottom Line: You need to bring your political A-game if you want to survive here.   The Organization:  It's common to hear ""this place is like a startup"". It is in some ways. Unfortunately, the more positive aspects of startup culture are not represented here. In a startup people tend to rally behind the mission and all pull together to accomplish goals. Success is interdependent at a startup.   Just the opposite is true at the foundation. It's very much a zero-sum game and success is not conceived of as being mutual. Turf wars abound between teams and within teams; struggling for attention/blessing from the highest levels of foundation leadership, funding for their projects, team headcount, and media coverage. This creates a lot of enmity between people and teams, the greatest casualties are the great ideas that never come to fruition and missed opportunities. Being a team player is not on anyone's annual goals.  The organization is constantly reorganizing. This creates a lot of uncertainty for projects, issues and the people who work on them. Twelve to eighteen months between major reorganizations is about the norm, shorter for more minor reorgs. Leadership can't seem stick with one operating model long enough to thoroughly vet it before moving on to the next thing. ""Top tier"" management consulting companies have deeply embedded themselves at the foundation and attached themselves to influential leaders. These management consultants are very effective at triggering reorganizations which result in a big payday for them.    The Leadership:  The incentive is to ""manage up"" rather than manage across or down. Without a good boss/mentor/champion behind you, it's very difficult if not impossible to advance your career here. Very few people are lucky enough to find someone who wants to pull them up.  There is little to no emphasis on working together better. After an internal analysis revealed a level of dissatisfaction around the culture and how people worked together, a senior leader was asked what was being done to improve the situation. This leader indicated to the staff that those are not the metrics that leadership is focused on.    The Work:  The public perception may be that the foundation is a fulfilling place to work because of all the good it does. The reality is quite different. The foundation is essentially a checkbook and as an everyday employee you are many layers away from the work being performed on the ground by sub-sub-sub-sub-contractors. Additionally, the foundation's grantees and vendors charge what is known as ""Gates rates"". Almost every request for funding or contract is significantly inflated. It's often disheartening to see so much of the budget be eaten up by inflated expenses.  The foundation tends to work with the same set of ""partners"" who have become entrenched interests at the foundation. There's very little appetite or ability to solicit fresh new ideas from hungry, smaller partners. In the case of these large entrenched, and often highly entitled, partners, the relationships have become dysfunctional - more about the money than the good work.  Strategy refreshes for issues are frequent, intense and can take upwards of 5 months to complete. This prevents the real work from being done on the ground. Supporting these strategy refreshes is another huge stream of money for ""top tier"" management consulting firms working at the foundation.   The Coworkers:  Cautionary tale: I got thrown under the bus on my third day of employment after being invited out for a ""welcome lunch"" by one of my peers. On the fourth day our group's Business Officer chewed me out because my lunch-mate from the previous day had reported me and intentionally misrepresented what I said. You never know who you can really trust.  People from the northwest tend to be pretty frosty and passive aggressive, but the folks here take it to a whole new level. Feeling completely alone in a building of 800+ people was common.  Unfortunately, the lower you are on the totem pole, the tougher it is. The lowest level employees, the Program Assistants and Program Coordinators have it the worst. The treatment they received from higher ups was often thoughtless as if they were lesser humans and sometimes bordered on abusive. Many people who are Senior Program Officers and above demand to be waited on hand and foot. Example: many of them don't know how or refuse to print their own documents.   HR is completely ineffective. They will always take the side of the higher ranking employee. Staying out of the cross hairs of others is your best and probably only defense."
"Great mission, too many strategy changes",2013-01-20,"Project Coordinator in Seattle, WA",4,,The foundation has tremendous benefits and incredible people and a laudible mission,"the culture is largely ego driven, hierarchial and the strategy changes constantly."
Great benefits and mission to engage in,2017-02-18,"Program Assistant in Seattle, WA",5,,"Benefits, location, time off, shared mission","There is a very heavy, liberal political cloud that encompasses everything, despite the foundation's official ""neutral"" stance."
It's all about the manager,2015-09-02,"Program Officer in Seattle, WA",3,,"Ridiculously good benefits, beautiful campus, frequent high-profile visitors","When there is a management issue, it is virtually impossible to get it addressed regardless of the route you take to deal with it. If you make too much noise about it, you become the problem."
