review_title,review_date,review_person,ratings,review_text,review_text_pro,review_text_con
"Great mission, improving culture",2022-05-17,"Senior Program Officer in Seattle, WA",5,,Opportunity to work with amazing people on some complex and important global and domestic challenges.  Increasingly intentional focus on inclusive culture and equitable partnerships.,"Hectic and political work environment, and priorities are still set from the top so a lot of time spent managing up."
Great benefits,2023-04-03,"Senior Business Analyst in Seattle, WA",5,,"Fun team environment, great benefits","Sometime ambiguous job duties, need better role clarity"
Great work but poor management,2023-02-05,"Program Officer in Seattle, WA",3,,Lots of smart talented people who are trying to move the needle in the best way they know and can.,"Upper management skews towards private sector backgrounds - management consulting, big pharma and may not have the technical expertise or insights to lead global health or development work."
Great mission,2023-03-14,"Senior Program Officer, Global Health in Seattle, WA",4,,Amazing working on great mission. Extremely fulfilling.,"Demanding job, but not really a con for someone who is driven."
"No heart, no soul",2022-07-01,"Senior Program Officer in Seattle, WA",2,,Access to resources to invest in important areas,"Constant layoffs and turnover due to consultant-driven strategy changes every couple of years. Institution does not care about employees, no effort to grow or retain, sees no value in institutional knowledge or mature relationships with partners and grantees. No logic, no values to layoffs. Behind the times in many areas because listening to consultants with no content expertise rather than technical experts on staff. Despite the rhetoric, extremely risk averse in grant-making. Delegation of authority (everything above 5 M needs approval at the Presidential level) leads to huge bottlenecks and very slow process--approx. 1 year to make a grant... whether it's for 5 million or 30 million--despite the fact that they obsess about strategy, have yearly portfolio reviews, etc."
strong mission but difficult culture,2022-11-17,"Anonymous Employee in Seattle, WA",3,,"Mission, salary, amazing benefits, almost unparalleled opportunity for global impact, network, access to major field leaders","competitive culture, bureaucracy, cookie cutter mold for internal success and advancement, lack of diversity in leadership, not enough time for true innovation and collaboration, pays lip service only to employee reported burnout. Lots of flux right now with governance changes and what it will mean for the organization's future mission and culture."
Program Officer,2023-01-29,"Associate Program Officer in Washington, DC",4,,"Benefits, working with smart people",Confusing org structure and a lot of ambiguity
great pay and benefits; each team has a different culture,2022-01-16,"Senior Program Officer in Seattle, WA",4,,"Pay and benefits are fantastic. These include six months of paid parental leave (although it used to be a full year) and a contribution to one's retirement fund of 15% your salary. In effect, this means that compensation is 15% higher that the salaries you see quoted. Also, if you work and live in Washington state, there's no state income tax. They have some very talented and experienced people at the foundation, and the mission, of course, is a very fulfilling and meaningful one. The foundation also has a very good reputation in most places, so it's a good line on one's resume, and contacting people with a foundation email address helps a lot in getting responses.","Ultimately it's Bill and Melinda who make the decisions. They are very involved in the work of the foundation, and _a lot_ of effort goes into preparing for presenting work to them, and it can be quite a political place. There's also an annual strategy review for most teams, so a lot of energy goes into preparing for that every year. The culture is very different from team to team. Some are amazing and collegial; others are absolutely poisonous, so ask around and have 1:1 conversations with people there before joining a team."
Great Work for a Great Cause,2022-11-11,"Associate in New York, NY",4,,access to leading research and knowledge base on the most pressing global issues,Politics can be challenging to navigate
"Smartest people, healthy culture, always evolving",2022-09-13,"Program Officer in Seattle, WA",5,,"- Got to define my own role - One of the best supervisors in my whole career - Excellent benefits (15% 403b contribution regardless of employee's contribution, generous medical, dental and vision insurances) - Caring teammates","- Teams and orgs are always evolving, needing lots of readjustment times - Essentially a family Foundation - Not enough visa sponsorship support"
"Hard work, with amazing people and benefits",2022-09-23,"Senior Program Assistant in Seattle, WA",4,,"- brilliant and dedicated colleagues - amazing benefits, including healthcare for my family and hefty retirement account contributions - fulfilling work -- with an inspiring mission","- high expectations, sometimes feels impossible - deadline driven and can be a high stress environment - frustrating bureaucracy that can slow down productivity - top heavy org structure, often lacking support roles"
Passionate and smart people; HR is a bit of a mess,2022-09-14,"Senior Officer, Strategy Planning in Seattle, WA",4,,"You will love what you work on, have so much purpose and passion for your work. The people around you are brilliant and super respectful, nice and awesome.",HR is a mess. Policies don't make any sense and they are slow. It's not great. In addition for business minded people career progression is a bit stunted
Great mission,2022-09-22,"Senior Assistant in Seattle, WA",5,,People care about the mission Excellent benefits Competitive pay Lots of resources to lean on Smart people- can make good connections Good leadership (executive leadership team),Lots of internal politics. Some teams are toxic and chaotic like any company. Challenging for admin staff to build their career in an upward trajectory.
Fine,2022-08-25,"Program Officer in Seattle, WA",4,,"Competitive pay, strong expertise among colleagues, impactful work, office perks like snacks and catered meals and swanky events","Norms of white dominance culture, sense of urgency, de-prioritization of equity across leadership"
Dysfunctional and Hypocritical,2021-08-03,"Senior Director in Seattle, WA",2,,"Beautiful buildings, great benefits, Mission you can get behind, Lots of Fun Events and Speakers Pre-Covid","Toxic Culture, wasteful spending, ineffective leadership, not as diverse as they like to tell the public they are, little career mobility. Want a ""yes man"" mentality - if you aren't that, you are deemed difficult."
"Great mission, improving culture",2022-05-17,"Senior Program Officer in Seattle, WA",5,,Opportunity to work with amazing people on some complex and important global and domestic challenges.  Increasingly intentional focus on inclusive culture and equitable partnerships.,"Hectic and political work environment, and priorities are still set from the top so a lot of time spent managing up."
Fantastic,2021-10-17,"Senior Program Officer in Seattle, WA",5,,"From the top leadership all the way through to program teams and business partners, the staff are fully committed to the foundation’s mission and values. It is a place to think big and think innovatively about the world’s most pressing challenges, while partnering with the most impactful and exciting local, national and global organizations. The internal environment is highly supportive, with strong, highly conscientious, emphasis on refining culture, values and the working environment. Finally, the benefits are second to none.","While strategy helps structure and articulate grant portfolios , it can constitute a significant - sometimes excessive - part of the work for all program teams, which otherwise could be devoted to grant design, local partnership building or other country-level work. Work life balance can be challenging to achieve based on the role, depending on if the team is sufficiently staffed, but can be developed with the manager."
"Amazing institution, good perks, too many re-orgs",2022-05-29,"Senior Program Officer in Seattle, WA",4,,Great institution doing amazing work. Smart and dedicated staff. Generous benefits.,There is nearly constant re-organizing that means the job you signed up to do may change drastically or disappear. Higher level staff seem blind to the costs of this churn.
Great place to work,2022-07-13,"Associate Strategy Officer in Seattle, WA",4,,Excellent benefits and impact on the job,Promotions based on tenure rather than performance
Feedback,2022-07-22,"Program Assistant in Seattle, WA",3,,Great benefits Fast-paced Great Connections,No growth opportunities for junior and support staff. Team cultures vary significantly
Good place,2022-07-09,"Senior Program Coordinator in Seattle, WA",4,,Benefits are great. Work life balance is ok.,Pay isn’t always equitable or transparent.
"Power, Potential, Politics & Hubris",2021-11-27,"Deputy Director in Seattle, WA",3,,"Powerful mission Ability to fund good work that matters, if you are on a team empowered to execute. Good benefits and supports - including during the pandemic. When you have the right leadership and manager you truly feel like you can make a difference in the world. Resources, and the doors they open.",Limited technical expertise or focus on impact in some teams. Constant strategy refresh and overall inward focus impedes long term impact.  Staff seen and treated as disposable = lack of psychological safety on many teams. Little change / impact on diversity and inclusion; no sense of belonging in many teams. Poor track record on immigration support to staff.
It’s Complicated,2022-06-11,"Program Officer in Washington, DC",3,,Great benefits and ability to partner with incredible communities,A bit bureaucratic and risk averse; demanding hours and expectations
Fantastic job,2022-03-28,"Program Assistant II in Seattle, WA",5,,"People are passionate, kind and engaging",Sometimes high level education means more than experience
Great mission-oriented organization,2022-02-25,"Associate Strategy Officer in Seattle, WA",5,,Mission-oriented teams Impact-focused organization Extremely smart and capable teammates,"The organization can be overly bureaucratic, particularly around budgeting cycles"
Just Know What You’re Getting Into...,2021-03-07,"Deputy Director in Seattle, WA",3,,"The Foundation is hands down the definition of generosity. The pay, benefits and perks are like no other. This review is not about the company and their generosity, it’s about the culture. When you get your shiny, impressive job offer, just know what you’re getting into. My rating is an average. 5 stars for the spirit of generosity, pay and working with fantastic people. 1 star for culture. To be fair, my rating fell in the middle at 3.","-First, the most brilliant minds in the world work here. It also means there is very little forward movement. We spend months talking and toiling about “strategy” and making everything more complicated than it needs to be. The partners in the field are doing the tough work. We are investing the money. It should not be that complicated - but the Gates culture is hooked on complicated.   -Second , lack of diversity and unconscious adherence to white supremacy culture where cutthroat behavior is normalized. Employees who are actually from the places we are supposed to be supporting are marginalized and/or pushed out. Grant dollars go to white-led, “elite” institutions and there is little interest in changing this. It’s actually quite shocking for a place that claims “All Lives Have Equal Value.”   -Third, the HR department is a disaster. HR gets a bad rap in most organizations and it’s not always fair. However, at the Foundation it’s the worst I’ve ever experienced. There are way too many of them (like 70 HR people). The left has no idea what the right is doing, you ask a question and you get four different answers, and the turnover is ridiculous. Ive been a people leader for 4 years and had over a dozen HR people come and go. You can barely get a question about basic benefits answered. Don’t get me started on the recruiting process and philosophy on pay equity.   -Fourth, your team will go through change every 6 months so just expect it and plan for it. I understand change is inevitable, but it’s almost a disease at the foundation. It goes back to my first point, they make things complicated for no reason, which results in constant change and reinventing the wheel over and over again."
Great opportunities,2022-02-24,"Senior Program Officer in Seattle, WA",4,,"Big complicated challenges, engage field partners.",Private family foundation; leadership focused on managing up more than down.
"Great benefits, lacks great culture.",2022-02-13,"Senior Program Assistant in Seattle, WA",4,,"Benefits, beautiful offices, great perks, incredible talent.","Culture, work life balance, pace, hierarchy."
"Work hard, great perks",2022-02-10,"Manager in Seattle, WA",4,,"Lots of smart colleagues and interesting work, good compensation","Long hours, hard to move up"
Happy in my role,2021-11-10,"Program Assistant in Seattle, WA",5,,"Benefits are great, if you click with your team it is a great community.","HR and management training could use some improvement especially compared to companies that put more time and emphasis and money on training their managers. However, if on the right team it does help!"
experience,2022-01-31,"Auditor in Los Angeles, CA",4,,nice work environment nice people,could get tired when sometimes
Great Environment with limited growth,2021-10-20,"Program Assistant in Seattle, WA",4,,Great environment and great benefits. There is generally a sense of urgency to solve GH problems. You are constantly surrounded by subject matter experts.,Limited growth especially if you are trying to switch from one job family to the other. i.e. Program Assistant to Program Coordinator. Every team is different.
"Good work life balance, excellent benefits and coworkers",2021-11-17,"Program Assistant in Seattle, WA",5,,"work life balance, organized and talented co-workers, team oriented, top notch benefits",not many opportunities for growth
"Great people, Great work",2021-02-01,"Software Test Engineer in Seattle, WA",5,,"The people at this company are some of the smartest and most dedicated I've ever met. Everyone truly believes in the value of what they are doing and this sense of duty is present in daily work and interactions. Benefits are amazing, pay is good, and ability to go to sleep at night has gone up remarkably with the start of this job.","People work a lot. People work so hard and so often that the company has ""quiet weeks"" which ensure that people can't do meetings and are forced to focus on work and take it easy. Management definitely tries to get people to work less but if your work is ""saving the world"" it becomes harder and harder to justify taking time off. That said, much effort is made to ensure that employees have a good work life balance."
Just Know What You’re Getting Into...,2021-03-07,"Deputy Director in Seattle, WA",3,,"The Foundation is hands down the definition of generosity. The pay, benefits and perks are like no other. This review is not about the company and their generosity, it’s about the culture. When you get your shiny, impressive job offer, just know what you’re getting into. My rating is an average. 5 stars for the spirit of generosity, pay and working with fantastic people. 1 star for culture. To be fair, my rating fell in the middle at 3.","-First, the most brilliant minds in the world work here. It also means there is very little forward movement. We spend months talking and toiling about “strategy” and making everything more complicated than it needs to be. The partners in the field are doing the tough work. We are investing the money. It should not be that complicated - but the Gates culture is hooked on complicated.   -Second , lack of diversity and unconscious adherence to white supremacy culture where cutthroat behavior is normalized. Employees who are actually from the places we are supposed to be supporting are marginalized and/or pushed out. Grant dollars go to white-led, “elite” institutions and there is little interest in changing this. It’s actually quite shocking for a place that claims “All Lives Have Equal Value.”   -Third, the HR department is a disaster. HR gets a bad rap in most organizations and it’s not always fair. However, at the Foundation it’s the worst I’ve ever experienced. There are way too many of them (like 70 HR people). The left has no idea what the right is doing, you ask a question and you get four different answers, and the turnover is ridiculous. Ive been a people leader for 4 years and had over a dozen HR people come and go. You can barely get a question about basic benefits answered. Don’t get me started on the recruiting process and philosophy on pay equity.   -Fourth, your team will go through change every 6 months so just expect it and plan for it. I understand change is inevitable, but it’s almost a disease at the foundation. It goes back to my first point, they make things complicated for no reason, which results in constant change and reinventing the wheel over and over again."
Diet,2021-11-11,"Dietary Aide in North Chicago, IL",5,,It is a great place to work,It’s very far away from my home
Middle Management Rules the Day,2021-03-01,"Senior Program Officer in Seattle, WA",3,,- Great benefits - CEO who seems to genuinely care and wants to work on known cultural problems - Beautiful campus - Connection to a larger mission,"- Your experience is highly manager-dependent and while many are good, some are appallingly bad with little to no consequence. - Performance, credentials, and expertise are valued over interpersonal skills and trust building, allowing some individuals to get away with abusive behavior without consequence. - Total lack of diversity and unconscious adherence to white supremacy culture where cutthroat behavior is normalized and employees who are actually from the places we work are marginalized and/or pushed out and where grant dollars go to white-led institutions, especially in research. - Smart young people are hired and then marginalized with little opportunity for upward mobility. Generally, BMGF is the place to finish your career, not get it started (although there are a few exceptions). Programmatic roles are generally occupied by people who skew toward retirement age.  - Generous benefits for parents on paper, but systemic discrimination of women with caregiving responsibilities in practice. This has showed up in major ways during COVID, where expectation have remained astronomically high and women are starting to leave. I know of several instances of women being denied opportunities or pushed out because of their caregiving responsibilities during COVID. - Major disconnect between our ""talk"" (i.e. what Bill and Melinda write and speak about) and our ""walk"" (i.e. how we do our work and how employees are treated internally)."
Great place to work,2021-10-07,"Advisor in Seattle, WA",4,,Everyone is mission-driven and that is very present,Company culture could be better
"Great entry, mid or end career employer",2021-08-10,"Associate Program Officer in Seattle, WA",4,,"Excellent place to spend a moment of your career, great salary, wonderful colleagues.","Minimal opportunity for growth and a challenging work-life balance. ""Unlimited vacation time"" is a joke."
Great place to work,2021-09-02,"Associate Strategy Officer in Seattle, WA",5,,Mission-oriented organization oriented towards maximizing social impact,Leadership and decisions can feel highly bureaucratic
Great place to work,2021-10-07,"Advisor in Seattle, WA",4,,Everyone is mission-driven and that is very present,Company culture could be better
"Great entry, mid or end career employer",2021-08-10,"Associate Program Officer in Seattle, WA",4,,"Excellent place to spend a moment of your career, great salary, wonderful colleagues.","Minimal opportunity for growth and a challenging work-life balance. ""Unlimited vacation time"" is a joke."
Great place to work,2021-09-02,"Associate Strategy Officer in Seattle, WA",5,,Mission-oriented organization oriented towards maximizing social impact,Leadership and decisions can feel highly bureaucratic
Great Place,2021-08-10,"Executive Assistant in Seattle, WA",4,,Flexible work/life balance. Friendly and supportive. Easy commute when back to office occurs.,Overall my experience was great. I would not have had the opportunity to travel internationally.
Mission driven,2021-07-05,"Talent Management Leader in Seattle, WA",4,,Employees are motivate by the mission. And for many this is their passion and life’s work.,For many this is their life’s work and purpose which can result in very high goals and heavy workload.
Great,2021-06-30,"Program Officer in Seattle, WA",5,,Amazing colleagues. Great opportunities to drive impact. Great place to build at the beginning of your career.,Internal politics. Possibly too large and in sufficiently nimble.
"PA - in the door, out the door",2021-06-30,"Program Assistant in Seattle, WA",2,,"PA's are the backbone of this work, trying their best to make the work and lives of S/POs easier. Benefits are the best part of the job",Really hard to move up/gain autonomy
A great place to work,2021-07-15,"Senior Program Officer, Global Health in London, OH",5,,Fantastic mission and brilliant colleagues,Working from home during COVID
Eh,2021-06-04,"Program Assistant in Seattle, WA",4,,"Good benefits, good pay, good networking opportunities.","Very hierarchal, lots of type A personalities, tough work life balance."
Great and awful,2021-06-02,"Peer Tutor in Los Angeles, CA",5,,They’re good employers and the pay is great but the hours are limited,I wish for the hours to be more readily available
"Inspiring, political and commanding.",2021-02-01,"Program Officer in Seattle, WA",5,,"Expected to think big, demonstrate excellence, be strategic and very hard working.","As with anywhere, your experience will be dependent upon your manager in many ways. Get with a great manager, and the sky is the limit."
Sense of purpose,2021-02-23,"Senior Manager Program Management in Seattle, WA",5,,There’s no better place to work to have a clear sense of purpose and feel connected to the mission of the org.,Mis-alignment in IT spend vs level of service expectations
"PA - in the door, out the door",2021-06-30,"Program Assistant in Seattle, WA",2,,"PA's are the backbone of this work, trying their best to make the work and lives of S/POs easier. Benefits are the best part of the job",Really hard to move up/gain autonomy
"Great place to work, roles are demanding",2021-02-24,"Program Assistant in Seattle, WA",5,,"Top experts, cutting edge of foundation work.","Long hours, smartest-in-the-room mentality leads to interesting work environment."
Security,2021-03-25,"Information Security Analyst in Chicago, IL",5,,"Support, lots of resources, and amazing team","Strict dress code, must be on time"
Inspiring place to work,2018-07-20,"Program Officer in Seattle, WA",5,,"I'm constantly inspired by the work supported by BMGF, which impacts some of the biggest problems in global health. As a private foundation, they can take controversial stances and innovate in ways you often don't see elsewhere in development. I feel lucky to contribute.  Employees are treated very well. The benefits are amazing","There are the usual office politics, and a lot of credit-seeking driven by individual egos, but I think that is pretty normal in an organization, especially one trying to attract 'the best'.   Employees are treated very well, sometimes too well (e.g. business class flights), which is uncomfortable when thinking about the geographies we serve and how that money could be better spent."
"amazing benefits, amazing people",2021-02-03,"Senior Program Assistant in Seattle, WA",5,,"great benefits -- healthcare, parental leave, retirement, etc.  amazing colleagues and overall extremely rewarding work.",not a lot of growth opportunity for lower level employees
yep,2021-03-10,"Chef in Springfield, MA",4,,great job it's awesome time,none at all its great
Great impact and lots of resources,2021-02-20,"Communications Officer in Washington, DC",4,,Great impact and unlimited resources,Slow culture and lots of navel gazing
Great place,2021-02-18,"Delivery Driver in Jacksonville, FL",5,,Great people to work for,I have none at this moment
Exceptional,2021-01-22,"Associate Strategy Officer in Seattle, WA",5,,"Top-notch peers, culture, and sense of true passion.",Internal politics at times can get in the way of teams' ability to drive impact.
