review_title,review_date,review_person,ratings,review_text,review_text_pro,review_text_con
"It isn't perfect, but what place is?",2011-03-10,"Operations - Program Assistant in Seattle, WA",4,,"Generous benefits (insurance, matching for retirement, up to date technology items, free snacks/sodas, etc.), generally an overall positive team environment, individuals who are focused not only on their own professional improvements, but also overall team improvements.  As the foundation grows in size, there are gradual improvements to process which yes take time to implement, but are done so with careful consideration (albeit sometimes over democratic rationale) of input.  I am a 4+ year veteran of the foundation and I still love coming to work 95% of the time.","At times can be difficult to communicate effectively with other teams. What I don't understand are some of the budgeting decisions made as this organization operates under the idea that there is a limitation to funds yet the co-chairs spend literally crazy amounts of funds to build a new campus.  There are still general feelings of unfairness between programs and operations units - the program areas definitely get preferential treatment. Programs and operations are held to differing standards of ROI, expenditures, employee performance and behaviors. More could be done from the foundation's leadership team to finally once and for all truly try to change perspectives and behaviors between the programs and operations.  There are still pockets of individuals who choose to push their hierarchy/title upon others."
"Good pay, great benefits",2021-01-13,"Senior Program Coordinator in Seattle, WA",5,,"Good pay, great benefits, focus on good management/managers",Lack of diversity at the leadership level.
Great colleagues,2021-01-28,"Associate Program Officer in Seattle, WA",5,,Lots of learning and investment in employees,Hectic work pace and inefficient organizational structure.
Great place to work,2021-06-09,"Program Officer in Seattle, WA",3,,BMGF is a great place to work,I don't have any to report
Culture needs some work,2021-03-15,"Senior Program Officer, Global Development in Seattle, WA",3,,"Some great people, interesting and varied work, connections at high level with organisations all over the world","Culture can be tough, success is often measured by performance in meetings with the co-chairs rather than on programmatic performance."
Impact,2021-05-25,"Senior Program Officer in Seattle, WA",3,,Opportunity for impact is unparalleled.,Head count cap limits upward mobility.
Supportive,2020-12-29,"Program Officer in Seattle, WA",5,,Really good benefits and support structure,Slow decision making and bureaucracy
Unique Opportunity to support Science for Global Health Impact,2020-11-01,"Program Officer in Seattle, WA",4,,Inspiring Mission; Wonderful Colleagues; Flexible Work Structure; Data Driven,Lack of Internal Career Advancement
So much that's good with a couple of fatal flaw,2018-09-25,"Program Officer in Seattle, WA",3,,"-Inspiring mission with ability to connect your work every day to that mission -Opportunity to do interesting and novel work constantly; if you are willing to lean in to it, you can find tons of ways to add value -Amazing benefits - frankly, I can't imagine finding better ones anywhere -Smart and motivated colleagues -Decent work/life balance (somewhat depends on your team but if you're willing to set personal boundaries, people generally respect them) -Senior leadership's priorities are in the right place","-No clear or logical pathways for promotion -Job title in the program officer family can feel arbitrarily assigned -Visible voices and charisma are valued over quality of work execution; translates into a culture where men are systematically valued over women -You need a manager who values your work and advocates for you to move ahead; if you don't have that, you are out of luck -They over-hire and hire often without a clear idea of what folks will do when they get there -Senior leadership priorities don't always get translated to action that makes sense"
"Great place to work, but not a place where everyone will thrive",2018-06-06,"Program Officer in Seattle, WA",4,,"1. Opportunity to play a part in addressing some of the biggest, most important challenges of our time 2. You'll get professional opportunities here you won't get anywhere else (e.g. who you get to work with, events you get to participate in, speakers that come to the foundation) 3. Unparalleled benefits 4. Beautiful workspace 5. Very flexible working schedule","You're experience will vary widely team-by-team, but basically:  1. The foundation has yet to create a culture and work environment where people of different backgrounds can thrive. Right now, it favors workaholic types with American communication styles (e.g. speaking in bullets, very direct) 2. Pretty much constant change--the decision-making process for which is not always transparent or fair. 3. While the CEO and executive leadership team are trying to address this, managers are generally pretty weak. Don't expect a lot of time or support in terms of mentorship or support to grow your career. 4. Because there are few open positions, it can be hard to ""move up""--especially from PO to SPO and SPO to DD."
"Great mission, rewarding work but unhealthy culture of backstabbing, disrespect and lack of leadership.",2012-08-07,"Anonymous Employee in Seattle, WA",3,,"If you want to work with some of the brightest people, use the latest technology and feel like you're making a difference then this is an amazing place to work. The campus is beautiful and the benefits are exceptional. Great place for people who are self starters, who know what to do and just do it. The operations areas are among the more people-friendly areas in which to work. There is a great deal of opportunity here.","Unfortunately this is a very challenging environment. The executive management team doesn't seem to have a clue as to what the ""worker bees"" need to get their jobs done. Their answer is process and more process. Just when you think there can't possibly be another set of templates, another committee, another whole department with some long acronym designed to help you get stuff done... And, at the end of the day, you are just a cog in the machine. They know the work will chew you up in 2 or 3 years tops. And they don't care because there is an endless parade of wide eyed people eager to have a chance to work there. Many managers have no idea how to manage people. Don't bother complaining to HR though. HR is the department of platitudes."
Nothing good comes easy.,2019-12-15,"Senior Program Coordinator in Seattle, WA",4,,"At BMGF I worked with some of the most remarkable colleagues - not just intelligent and accomplished, but truly kind and caring folks with unique backgrounds and life experiences to contribute. Benefits are outstanding. Wonderful, consistent learning opportunities and depending on your team, chances to stretch and gain new skills with exciting projects.","Nothing dominates an organizational culture more than how it defines success. At BMGF, success is working as diligently as possible, as often as possible, and being the smartest person in the room (or at least in your subject area). Its borderline obsessed with how ""complicated"" and ""difficult"" its work is, and it sometimes seems like you earn more points for taking apart a problem analytically, than actually figuring out how to have tangible impact The result is a very curious, learning-oriented, but ultimately inward-facing organization that's more afraid to fail than its willing to admit. If you're already working in development, this won't be news to you. But any person should know what you're getting into, and how you want to navigate it - work/life balance will be 100% up to you."
Program Assistant at BMGF,2021-01-17,"Program Assistant in Seattle, WA",3,,"Great benefits, good pay, talented colleagues",If you do not contribute technical expertise to programmatic teams you will be considered (and treated like) a second-class citizen.
Hello,2020-10-10,"Anonymous Employee in Arlington, TX",5,,Good job nothing bad to say,I do not have any kinds right now
Ok,2020-10-30,"Analyst in Chicago, IL",5,,"Impact, Friends, Bill, Impact, Impact",Everything is too slow. OK
"Great mission, great people, great benefits",2020-08-26,"Senior Program Officer Global Policy & Advocacy in Seattle, WA",5,,"Excellent benefits, fair compensation, and the mission is at the core of the work.","Evolving DEI approach, little mobility internally."
Amazing professional experience,2020-08-15,"Summer Intern in Washington, DC",4,,Intern program is extremely well structured to introduce interns to Foundation leadership and the breadth of organizational functions. Competitive pay and excellent professional development opportunities.,The intern program is not designed to culminate in a potential job offer.
BMGF,2020-08-29,"Program Officer in Seattle, WA",4,,Amazing work and fantastic mission,The majority of managers are technically trained and should not manage people.
inspiring opportunity with smart colleagues,2020-10-08,"Associate Strategy Officer in Seattle, WA",5,,smart colleagues and mission driven,no clear career progression opportunity
Hello,2020-10-10,"Anonymous Employee in Arlington, TX",5,,Good job nothing bad to say,I do not have any kinds right now
"Inspiring mission, too bogged down in internal politics",2016-05-07,"Program Officer in Seattle, WA",3,,"The pay and benefits are amazing, and the mission is inspiring. In my experience I've been able to professionally develop and advance within the organization, although I agree with other reviews that these opportunities can be highly dependent on supportive teams and managers. Representing the foundation you get to be a part of many high-level conversations at the global level and benefit from working with partners who are at the forefront of the field in both research and implementation.","The work environment is very politically charged and it is easy to get bogged down in internal churn. I don't know if it is typical for this size of an organization, but the number of reorgs seems unnecessary and a huge barrier for getting work done. It's also tough for morale when smart and effective people are getting laid off and people who are good at upward politics but seem to care less about the actual work are recognized and promoted."
Ok,2020-10-30,"Analyst in Chicago, IL",5,,"Impact, Friends, Bill, Impact, Impact",Everything is too slow. OK
Prepare for bureaucracy if you work here.,2015-06-21,"Senior Analyst in Seattle, WA",3,,Benefits package is outstanding. Some genuinely nice people. The belief that what you are doing is truly helping to save the world. Beautiful offices and landscaping. Onsite fitness gym and food (food is not free).,"Continual hiring of individuals only for their field/specialty talent results in individuals in key roles who have no experience or interest with people management, career development, technology, or communication skills beyond the grantees.  The framework (of how teams report upwards) and executive leadership continues to operate in a clunky old-boys club fashion. Considering how dismal morale is across the entire company, I and many others believe that change is currently underway; however, the change is being done in such a mean, rapid, and secretive state that many current employees such as myself are meant to feel like pawns.  The family feeling that once existed as vanished and there is no hope of it coming back. Bill and Melinda have not been present."
"Great mission, great people, great benefits",2020-08-26,"Senior Program Officer Global Policy & Advocacy in Seattle, WA",5,,"Excellent benefits, fair compensation, and the mission is at the core of the work.","Evolving DEI approach, little mobility internally."
Amazing professional experience,2020-08-15,"Summer Intern in Washington, DC",4,,Intern program is extremely well structured to introduce interns to Foundation leadership and the breadth of organizational functions. Competitive pay and excellent professional development opportunities.,The intern program is not designed to culminate in a potential job offer.
BMGF,2020-08-29,"Program Officer in Seattle, WA",4,,Amazing work and fantastic mission,The majority of managers are technically trained and should not manage people.
inspiring opportunity with smart colleagues,2020-10-08,"Associate Strategy Officer in Seattle, WA",5,,smart colleagues and mission driven,no clear career progression opportunity
The Hunger Games lived daily.,2016-02-09,"Business Analyst in Seattle, WA",1,,Mission & benefits but not worth abuse from colleagues and managers.,"Management is incompetent; crippled by bureaucracy. They can't make a decision without hiring at least two consulting firms tell them what they should do. The consulting firms have this figured out and take advantage at every turn, but management can't see it. Fear of technology and change is a core competency at the foundation. Stay away from IT if you like working with the latest and greatest technology. Change management and holding the users hand are the most critical elements of a project. If you don't like writing job aids for bone headed talks, the foundation is not for you. The foundation has implemented the stack ranking review process Microsoft abandoned two years ago. It was very interesting to see how it plays out in a female dominated workplace. It is much more brutal than at Microsoft. Lies about my character, that my boss knew was false ended up in my review. I've seen four people in four years get fired by my boss or direct reports because they don't like them. The environment reminds me of the sorority I quit in college. There is no teamwork."
Nowhere else like here,2017-09-13,"Director in Seattle, WA",5,,"Today I had an amazing lunch conversation at Gates with a colleague talking about how one of our grants is enabling the largest mapping of social networks ever attempted - across nearly 800 villages in Honduras - to accelerate the speed and adoption of transformative health outcomes. I looked up and realized similar inspiring and innovative conversations were happening all around me. Smart, creative, passionate, committed colleagues, all leaning in to changing the world at scale. Yes, there are challenging days yet that's often the case when trying to do big things that matter. It's a real privilege to be here.","Under Sue (CEO), the foundation is making huge strides forward in everything from culture to management and from simplification to fun. Yet, there are still managers and leaders here not fully on the bus, so the place can feel uneven. Best to understand the nature and dynamics of the team you are joining beforehand."
Company Review,2020-09-29,"Program Assistant in Seattle, WA",5,,"Amazing passion and determination in colleagues, great benefits",Lack of work life balance
Senior Program Officer,2018-11-15,"Anonymous Employee in Seattle, WA",3,,Bill and Melinda are tackling some of the toughest problems in the world. They do not give up on challenging issues. Employees are mission driven and care about the work they do. Lots of smart people to work with. Great benefits- full year off for paternity/maternity with pay.,"US Program senior leadership jumps when Bill raises an eyebrow. There is constant change on the tools used to get the job done. Silly issues like open space and where people sit dominate office politics. Motto is ""overthinking analysis"" which leads to public paralysis. Most of the work is feeding the machine."
Good place to work but not the best place to work.,2014-12-12,"Anonymous Employee in Seattle, WA",2,,"Best benefit package. Great retirement benefits.  Some awesome pool of smart super intelligent people.  People from diverse background understand and follow the mission. Great campus. Get to meet with Bill & Melinda, Mr. Bill Sr., and also Warren Buffet.","Not the best place to work. Hurts to see that many people don't even follow the mission. Apparently 'All lives have equal value', is not practiced by each manager. Amazing to see that your title speaks so much about the behavior and treatment from high level people, especially in your own team. You will be the luckiest if you end up in a team that has a great manager.   No growth opportunities. If u apply for other roles within the organization, you become the most unfavorable person on the team.   A lot of perception which is highly biased and doesn't work in your favor. If they don't want you they will find a reason you ensure you are gone. Double standards are hurtful to see. Hoping that with the new CEO, things will change for better."
Assistant,2016-03-30,"Assistant in Seattle, WA",2,,"The benefits cannot be overstated, they are unbelievably generous. The mission and resources available to ""drive toward impact"" (a very gatesian term) is noble and lofty. You may also get to work with some of the smartest, humblest, and nicest people in the world and learn so much.","It is more likely that you will work alongside people who are just trying to do their job and stay under the radar. Too many reorgs, too many bad managers, and too much political lobbying for too few promotions from within the organization. Program staff can only get so far and then they just get more work and more responsibility dumped on them and support staff have nowhere to go. When opportunities do arise, it is always a cattle call and survival of the fittest. The most politically well-connected win the day. Skill, experience, competency, commitment don't always mean anything."
Potential to be a truly premier employer,2017-07-19,"Director in Seattle, WA",4,,High caliber staff; mission-driven organization that is having global impact; challenging work that provides career development opportunities; exceptional benefits; very competitive base pay for most roles; workplace amenities.,"High workload and ineffective prioritization by leadership and managers creates employee burnout/frustration and failure to focus on highest priorities (org wide challenge); ongoing turnover of execs on operations side; inability to figure out business and resourcing model for global strategies; ongoing strategy changes/new directions require employees to be highly change agile and comfortable dealing with ambiguity, reorgs, new managers, etc.; terrible commute for Seattle employees due to Mercer/S. Lake Union congestion"
Constant Growth and Learning Opportunities,2012-02-22,"in Seattle, WA",5,,"* The mission and values of the company can't be beat * All health care covered, including domestic partners * Money Share Account in which 15% of your annual pay is automatically contributed by the foundation * They match your personal donations to charitable organizations by 3xs * Many opportunities for promotion if you are a self-starter and proactive * Lots of parents with young kids work here * Wonderful office/campus (across the street from the Seattle Center) *Great commuter benefits","*If you aren't liberal or progressive, this is NOT the place for you * Ethnic diversity is low, despite the work we do. Therefore you can feel like a ""colonizer"" at times. Most of the senior leadership at this (global organization) is white and male- and from South Africa at that. (They just replaced their Asian president of Global Health, and their female president of Global Development with white men- go figure.  * Passive-aggressive, but this also reflects the PNW/Seattle area * Lots of Type A people, and many who don't have a lot of personality * They often overhire, i.e., many of the program assistants (admin assist.) have two degrees."
"good foundation, great mission, questionable internal politics",2014-04-02,"IT Engineer in Seattle, WA",4,,"Great mission, loved the fact that you felt your work everyday impacted others who are less fortunate. The benefits, even as a contractor are great, snacks / drinks on site, wonderful location, right next to the space needle. Great compensation for my position, I have heard this is similar throughout the organization, at lots of levels. On-site cafeteria is amazing, probably on par with Microsoft campus, if not better.","Bizarre internal politics, team A will let team B fail just so they can claim 'they told you so', things I've never seen in corporate america or anywhere really. A lot of times as a contractor you will be dangled a carrot (of a full time position) that will never materialize (minor critique)."
Competitive Environment with very Smart Co-Workers,2013-09-22,"Program Coordinator in Seattle, WA",4,,"Everyone can agree that the Bill & Melinda Gates Foundation does world changing work. I have worked there in two different capacities two different times in the last 9 years and the culture of highly competitive, extremely intelligent people remain. The company still operates as a young organization in that it embraces new ideas and it's always evolving. People who dislike change would not be happy here. The benefits can't be beat and the environment is stunning in the new campus. They encourage working from home and remote work, which is helpful in the sometimes intense and stressful office environment.","This is a company of academics, there is not a lot of silliness or fun happening at this organization, which makes sense due to the importance of their mission. There is a competitive feeling throughout the company that can feel oppressive, but they still embrance a sense of creativity and change. They constantly re-org often with little to no notice or reasoning behind the changes which is pretty jarring, so you have to be someone who can embrance change easily to thrive in this environment."
Culture is intense. Mission is inspirational. Benefits are awesome!,2014-04-17,"Business Analyst in Seattle, WA",5,,"- You will never lose your job because of the economy - You will be around the most passionate, intelligent, and dedicated people on the planet - The benefits are incredible especially if you have a family","- You will likely lose your job because of burnout or a random reorganization - Consultants will probably get the roles you want. If you're working in supporting the mission outside of the grant-making process (such as in IT, Finance, HR etc), you will feel a little left out from the grantee-facing work - Culture is highly political and heroic efforts are expected. Sometimes, you will wonder whether better planning could have prevented the heroic efforts"
Where smart people go to feel stupid...,2015-11-22,"Senior Program Officer in Seattle, WA",3,,"Amazing bright colleagues, inspiring mission, great benefits, most people in the country will return your calls.  Great learning opportunities.","They hire some of the best and the brightest, but then give them little power to act on it. Unrealistic faith that great strategic planning and technology alone can change the world Too much value placed on to ""manage up"" -- especially to Bill (that guy in the corner office)"
A fast-paced place to learn tremendously but you have to like being under constant stress,2012-12-02,"Program Assistant in Seattle, WA",4,,"If you like being around smart interesting people with amazing backgrounds and ambitions, BMGF is great. You learn a lot and if you have a great manager, can grow.   Lots of resources for creativity.","Generally a stressful and competitive place. HR and management is poor-- not a lot of transparency, accountability and feedback loops, poor consistency and standards, lots of people without management experience doing management. Lots of smart people means lots of ego to deal with. The organization is constantly reorganizing and this is also stressful. Top and bottom heavy organization with little clear upward mobility within the organization."
"Bad culture and employees are used, burnt out and discarded.",2017-10-26,"Senior Program Officer in Seattle, WA",1,,"The BMGF is a place where you can make a difference, but see below for the downsides. Working for the BMGF is very interesting and can be rewarding, but you need to celebrate internally because no one ever says 'thank you' or 'good job'.","Terrible work environment and culture. The pace and the demands of the job eventually wear you down mentally and physically and many employees end up needing mental health care. Everyone who works on a scientific or technical team is eventually forced out of the organization by their manager or management, usually in a horrible undignified way. Employees are used by the organization until they are burned out and then they are cast adrift. The co-chairs when asked will admit that they aren't looking for long term employees. What matters most to the BMGF is the Gates' family brand."
Great opportunities for hard working individuals,2016-01-24,"Senior Program Assistant in Seattle, WA",5,,"The mission of the foundation is one that makes you proud to come to work every day. That coupled with an amazing facility to work in and smart, caring coworkers, make it a great place to work.",Opportunities for advancement are far and few between. It isn't impossible but it not only takes hard work but you need the good fortune of a manager who cares about your career. Not everyone finds themselves in this fortunate situation.
