review_title,review_date,review_person,ratings,review_text,review_text_pro,review_text_con
Megacorp,2021-05-21,Software Engineer,5,,"Salary, work/life balance, free food, flexibility.",Takes a lot of pushing to get things done sometimes. Lots of process.
Great company to work for,2021-06-11,"Head of Product Marketing in New York, NY",5,,"flexibility, respect, food, remote work","moving slow, bureaucracy, political, hierarchical"
Innovative & fast paced,2021-06-11,"Head of Product Partnerships in Sunnyvale, CA",5,,Amazing people Challenging assignments Global roles Global teams Diverse teams,Matrix organization Complex decision making Large company
"Awesome environment to work in, Well run",2021-03-03,"Data Analyst in Palo Alto, CA",5,,"- Flexibility in your work & objectives, opportunities to explore and grow - Great perks, benefits, and compensation - Can choose good work-life balance - Work with experts, great talent all around","- Hard to move up, get promoted - Culture has been in decline, some legacy businesses are slow to adapt - Competitiveness internally sometimes cannibalizes good work"
Good salary,2021-06-13,"Anonymous Employee in Log Cabin, TX",5,,Good salary and good logo,I am fired and simplified chrome logo
Not what it used to be.,2021-05-12,"Release Engineer in Sunnyvale, CA",2,,Eye-glasses benefits are very good.,Health benefits have been cut back. Too much drama in the DEI initiatives (firing those driving it). Harder to move around.
great place,2021-06-19,"Software Engineer in San Francisco, CA",4,,A very good company yay,There were not many cons
"Great perks, be aware of slow leveling",2021-04-21,"Policy Specialist in Austin, TX",5,,"Wonderful teammates, creative workspaces, great perks and flexible time off","Leveling/progression is dependent on the team, which can be slow/incongruous with the work you do"
Becoming just another big company.,2021-03-29,Staff Software Engineer,3,,Some teams still have good/old-google culture. Mgmt still somewhat seems to care about how happy employees are.,Lots of pointless projects going nowhere. Politics. Culture is eroding. Theoretical care for employee well-being comes in second to pressure to ship.
very good,2021-05-28,"Engineer in Menlo Park, CA",5,,a lot of money for filling forms,not a lot of work
best and best,2021-05-30,"Software Developer in New York, NY",5,,good salary nice package  freindly enivornment,nothing so far i see
Great,2021-06-01,Research Assistant,5,,"Amazing experience, great work environment",I wouldn't change anything about it
Software,2021-06-04,"Senior Software Engineer in New York, NY",4,,Free snacks and drinks and coffee,Not much to talk about
review headline,2021-05-17,"Senior Site Reliability Engineer in Sunnyvale, CA",4,,"big company, best practices are mostly respected.","no-teamwork, envy, no-open-source, proprietary systems, lowest-level managers."
Great People,2021-05-17,"Sales Manager in Las Vegas, NV",5,,They care about you and your family,No real cons... I just want a bigger company experience
Good WLB,2021-05-22,"Software Engineer in Mountain View, CA",4,,Good work life balance Good culture and atmosphere,Slow to get promoted; things done in slower pace.
Great Company for Great People,2021-03-04,"Senior Backend Engineer in Menlo Park, CA",4,,-Great benefits  -Flexible hours -Professional managers,-Culture is intolerant of dissenting opinions but I've seen them making improvements upon direct feedback  -Work can be monotonous  -Big company equals big problems that often don't get resolved.
good,2021-04-13,Anonymous Employee,5,,liked it yay pretty good,sometimes didnt like it tho
Love it,2021-03-15,"Product Manager in New York, NY",5,,"Great company, great mission. Best place to be a product manager.","Classic big company stuff. Lots of reviews, you know the drill."
Evil Company,2021-10-04,"Anonymous Employee in Austin, TX",1,,Work in the USA the best country in the world.,Evil company trying to destroy the USA.
go,2021-08-20,Hopsice Nurse,3,,It was an alright experience,goof it was pretty alright
Okay,2021-08-08,"Communications Manager in San Francisco, CA",4,,"Good pay, perks and queso at Masa",You have to be political to get promotions
Good,2021-08-16,Software Engineer,4,,good projects and coworkers here,sometimes slow learning for some projects
Good Work!,2021-08-12,"Analyst in San Francisco, CA",4,,"Fun, great perks and benefits","a lot of wok, far form SF"
Google Software Engineer Review,2021-01-17,"Software Engineer in New York, NY",5,,"- Comes with many benefits, such as free food, high salary, good work-life balance and more!","- Could possibly fall into the ""golden handcuffs"" and will not want to leave the comfort zone"
love it love it love it,2021-03-28,SWE Intern,5,,best place ever to work,so much work for a new grad
Great Company,2021-04-08,"Software Engineer in San Francisco, CA",5,,Nicely paid. Not too much pressure.,Found no cons so far.
Great place,2021-04-22,"Sales Manager in Raleigh, NC",5,,Amazing people with the best perks,Tons of work and progression paths unclear at times
Great place,2021-04-23,"Developer Advocate in New York, NY",5,,"Money, people, benefits, dogs in office","Bureaucracy, processes, feeling like a cog in the wheel"
Great place to work,2021-04-23,Account Manager,5,,Benefits are great and senior leadership,Promotions can be challenging and very competitive
Best place to work,2021-04-24,"Senior TPM in Redmond, WA",5,,Good benefits and opportunities to grow,Nothing to share at this time
Great if one can find the right team & figure out the promo process,2021-03-22,"Senior Software Engineer in Kirkland, WA",4,,* # of Projects/Opportunities available * High quality coworkers * Perks,* Steep learning curve of promo process [for some]
Awesome branch,2021-04-13,"Professor in New York, NY",5,,"high pay, great collegues, great perks","long ride from home, long waitlines at lunch"
Good company to work for,2021-02-23,"Senior Program Manager in New York, NY",5,,"Great people, compensation, great food, great culture, and really appreciate the focus that the company puts on career development.",The company is large and its slow to get things done if you're used to a faster paced environment.
Great,2021-04-15,"Receiver in New York, NY",5,,Knowledge & Growth with company and very diverse,Can be more organized at times
hello,2021-04-28,"Director of User Experience in New York, NY",5,,its google so it fun.,way to many people you might get lost
Great Culture,2021-04-28,"Financial Analyst in Mountain View, CA",5,,Amazing Culture and Workplace Diversity,Upper Management could be a little better
top company,2021-03-13,"Software Engineer in San Jose, CA",5,,smartest people I worked with.,"still, no remote work options."
Generally good,2021-05-26,"Software Development Engineer (SDE) in Mountain View, CA",3,,Very flexible working hour. Nobody pushes you,"You still need to have outputs by quarters. Stacking good engs at L4,L5. So it’s hard to get opportunities to show you are capable to do higher level projects thus get promoted."
because!,2021-03-15,"Journalism in New York, NY",5,,everything is good there because,nothing is bad there because
B,2021-03-06,"Product Manager in South San Francisco, CA",5,,Stock price is really good !,It’s a lot of work for one person
Excelent place to work,2021-02-01,"Software Engineer in Mountain View, CA",5,,Great infrastructure and tools to work with.,"Large company, sometimes I feel I am not doing too much or having a lot of impact on it."
"Great place to work, but increasingly bureaucratic",2021-04-30,"Prinicple Software Engineer in Boston, MA",3,,"Great coworkers, great technology, great benefits","Huge amount of red tape, hard to make any changes or innovate. Very difficult to move fast and try new things."
Great place to start sales career,2021-02-10,"Senior Sales Executive in Los Angeles, CA",5,,"Great mentorship, opportunity to advance",I can't list any real cons
Good Culture,2021-02-18,Software Engineer,5,,"Flexible work hours, free food, excellent culture and everyone here is nice.",Moving relatively slow comparing to other large companies.
awesome place,2021-03-08,"Manager in New York, NY",5,,"good people all around, open minded",none that I can think of
Great place to work,2021-03-08,"Global Process Manager in Chicago, IL",5,,Coworkers Office Location Stock Option Annual Bonus High Salary,Competition Peer Pressure Small number of Promotions
Good,2021-04-08,Technician,5,,"Good pay, good comp, good",There are not too many cons
Pros and cons,2021-03-29,Marketing Manager,4,,"Benefits, growing, innovative, fast-paced, exciting","Structural, growing pains across verticals that are seemingly difficult"
Great place to work,2021-03-29,Business Development Manager,5,,"Great teammates, perks, and scale of business.",Potentially long durations between promotions.
"Great Culture and WLB, Smart Colleagues, Huge Growth Potential",2021-01-18,"Product Manager in Sunnyvale, CA",5,,"Senior roles have huge scope, can really make a difference to product/division, better WLB than other FAANG companies, really like and respect my colleagues","Can be slow moving, slow career progression, seems like it's always performance review season"
Good job,2021-03-21,"Student Worker in Los Angeles, CA",2,,The coworkers and pay were good,The criticism is a little tough at times
google career,2021-03-20,Online Strategist,5,,"great benefits, great culture and great colleagues",there is not really any cons that i can think of
overall good work environment,2021-04-01,"Fincial Analyst in Mountain View, CA",3,,Bad management affects employee morale,Great food choices for lunch  Free birthday massage
working at google,2021-04-01,Anonymous Employee,5,,nice to work with friendly people,lot of time to do work
Product Managers struggle at Google,2021-03-13,"Product Manager in San Francisco, CA",3,,Great tools and infra for building and testing new products and ideas,Women not paid enough and not promoted enough
great place to work,2021-03-25,"Director in San Francisco, CA",5,,"very ""googley"", inclusive and great environment","large, complex organization which makes decision making slow"
Great place to work,2021-03-04,"Anonymous Employee in Cambridge, MA",5,,"Great company to work, learn and grow.","Still a great place to work for, but has become very bureaucratic"
Good place,2021-03-23,"CEO-Founder in Sacramento, CA",4,,"Good pay, lots of creative freedom",Expect a lot of hours and production
Great place to work,2021-03-24,"Software Engineer in Seattle, WA",5,,"Culture, People, Momentum, Atmosphere, Compensation",Non-portable internal tools Slow language adoption
Love the company,2021-03-14,"Senior Director in Los Angeles, CA",5,,"Benefits, people, mission, meaningful work, creativity.",Sometimes things can take longer than a start up.
Good Company,2021-03-25,"Software Engineer in Mountain View, CA",5,,A lot of resources to use,The projects might be boring
Great Company,2021-03-25,"Sales Strategy and Operations Manager in Mountain View, CA",5,,"Great People, fast work environment",large company problems and increasing bureaucracy
Review,2021-02-26,"Research Engineer in Mountain View, CA",5,,A typical bay area big tech company providing good working experience for junior researchers.,There are a lot of unqualified engineers in the company.
Good company,2021-03-28,"UI Designer in San Francisco, CA",5,,absolutely it's a good company,"no, there's really no cons"
Interesting place to work,2021-03-18,Marketing Specialist,5,,Several perks offered like flexible schedule,Business goals are not set up
Yes,2021-03-30,"Google Engineering Practicum in Los Angeles, CA",5,,Best company to work for,No negative comments at all.
great company,2021-05-05,"Senior Software Engineer in Sunnyvale, CA",4,,great WLB. smart colleauges interesting problems to solve,too slow. CEO is a peace time manager. nothing to show for the last 10 years.
Good culture,2021-01-27,"Software Engineer in San Jose, CA",5,,"Good culture, work life balance, technology.",Not enough career development opportunities.
Great,2021-01-27,"Software Engineer in Austin, TX",5,,"Great place to work, super smart people",No cons come to mind
Great work!,2021-01-28,"Product Manager in Cambridge, MA",5,,"Great place to work, great perks",A little slow in promotion
I miss the office,2020-12-10,"Software Engineer in Seattle, WA",5,,"The people, the food, the prestige! I just love working at Google.","I'm not enjoying ramping up on project remotely (Covid), but I have nothing bad to say about Google."
Great growth opportunities,2020-12-17,"Staff Software Engineer in Mountain View, CA",5,,"Great tech stack, people with growth mindset, can-do mentality, cutting-edge ML.",High coding bar. And you need to learn how to communicate effectively (many x-product and x-cultural collaborations)
good,2021-01-29,"Associate Account Strategist in Ann Arbor, MI",5,,amazing culture great people and fun,idk not many to say
Great place to work!,2021-01-15,"Product Designer in San Francisco, CA",5,,Design Support Good Perks Strong Mission,Can get lost easily and is fast paced
Best Place to Grow in Data Centers,2021-01-08,"Data Center Technician in San Jose, CA",5,,Lot's of Technologies to work with,"Have get familiarized on how ""Google"" does things."
none,2021-01-09,"Data Analyst/Data Scientist in New York, NY",5,,working hours are good and efficient,working hours are more and lengthy
Excellet,2021-01-12,"Technical Recruiter in San Francisco, CA",5,,"Fast paced, Challenging, Engaging, Friendly, Pay",Processes - nothing else to speak of
Fantastic,2021-01-12,"Software Engineer in San Francisco, CA",5,,Prestige  Work is rewarding Networking opportunities,Don’t be evil is kinda losing its meaning
great,2021-01-05,"Customer Service Agent in New York, NY",5,,friendly people and easy going,too much work and tight schedule
Head to the west,2021-01-05,"Accounts Receivable Specialist in Green Bay, WI",5,,Great place to be at,Don’t do the do if ya know
nice,2021-01-06,"Software Development Engineer In Test (SDET) in Mountain View, CA",5,,benefits are amazing for a given position,working hours are long and meeting deadlines are challenging
Good but not best,2021-05-11,"Software Engineer in Kirkland, WA",4,,Work life balance Competitive Salary Tons of perks,Toxic handling of diversity A lot of politics Unfriendly to certain ethnic background people
Good,2021-01-14,"Software Developer in Cleveland, OH",5,,Good company to work for.,Not many bad cons for this company.
AWESOME GIG,2021-01-14,"Manager in Chicago, IL",5,,great people who are incredibly dedicated,none i can think off
Great time,2021-01-14,Software Engineer,5,,It was easy to learn,The pressure was overwhelming at times
Great Company,2021-01-15,Account Executive,5,,Great culture and benefits and people,Management structure and constant travel
Very Good,2021-02-11,"Software Engineer III in New York, NY",5,,The food is fantastically good.,Is slowly moving away from its start up origins
Good company to work on,2021-01-27,"Software Engineer in Seattle, WA",5,,"Good wlb, smart people, good pay",Too big to have better impact and ownership compare to smaller company
Great place to work,2021-01-27,"Senior Python Developer in New York, NY",5,,Culture is awesome which is the best part,No cons for me as of now
Good,2021-02-20,Marketing,4,,Good culture and benefit. Love the people,Nothing special to say about
Best tech,2021-02-20,"Senior Engineer II in Austin, TX",5,,"Technology, food, culture, pto, perks",None i can think of
Growing,2021-01-20,"Account Executive in New York, NY",4,,Brilliant onboarding process and people Competitive compensation Flexible on start dates Open and accommodating interviewers,Chromebooks Less mature than some comparable competitors Not as established with much of it's customer base
Go google,2021-02-04,Account Manager,4,,"It's Google, can't beat that name recognition",Not diverse enough. Need to work on actually caring about minorities
Great place to work,2021-01-30,Administrative Assistant,5,,"Great big picture work, potential to expand into other fields","Hours can be tedious, especially at year-end"
Fantastic company,2021-02-17,Program Manager,5,,Best company I’ve ever worked at.,No major cons to report.
Great,2021-02-18,CEO-Founder,5,,Was a great place to work,Terrible time dealing with the Congress
Great company,2020-12-08,Senior Software Engineer,5,,Everything at this company is good.,Nothing is bad at this company.
Love Google,2020-12-08,"Program Manager in Austin, TX",5,,People who are part of the team,Compensation compared to FAANG companies
Interview,2020-12-15,Finance,5,,"Helpful recruiters, Good interview environment",Slow communication about interview results
Excellent place to work,2020-11-03,"Program Manager in Sunnyvale, CA",5,,"- Benefits (Healthcare, 401K match, PTO are all outstanding)  - Wonderful people to work with",-Limited work location flexibility depending on the team you're on
Nil,2020-11-15,"Software Engineer in Los Angeles, CA",5,,Good  Excellent Happy Great  Very well company And great service,Everything is going well with the job and no cons to say about this job
Awesome,2020-12-10,Janitor,5,,great work life balance and nice people,none. best work place ever
Overrated,2020-12-10,Anonymous Employee,5,,Lots and lots of money,Can’t think of any at the moment
"Ok place to work, depends on organization",2021-03-08,"Software Engineer in San Diego, CA",3,,-Lots of autonomy -Great pay/benefits -Movement around company is possible -Good work life balance,"-Lots of technical debt -Organizations, roles and responsibilities chaotic -Perf rewards making new stuff instead of making the current stuff better"
Good job,2020-12-07,Senior Data Analyst,5,,good food and snacks in office,moves slowly because so many people
High level personal view,2020-12-08,"Staff Software Engineer in Mountain View, CA",5,,"Awesome people, environment and perks",Nothing really bad to say
Terrific research culture and benefits,2020-10-22,"Research Scientist in Seattle, WA",5,,It's wonderful to be surrounded by peers who challenge and surprise me with their insights. The culture embedded within the research organization is amazing.,"It can be tempting to work too hard in order to keep up. There is definitely ""little fish, big pond"" syndrome going on throughout."
Great company,2021-01-06,"Marketing Manager in San Francisco, CA",5,,"autonomy, innovation, culture, fun atmosphere",it is a big company so sometimes it is hard to make impact quickly
Bad management,2021-01-30,"Computer Engineering in Miami Beach, FL",2,,"No food and drinks, bad working condition.",Bad management Bad working condition Good trouble.
Good job,2021-01-30,Software Engineer,4,,It’s a good job here.,Sometimes boring to work here
Good,2021-01-30,"Marketing Manager in San Francisco, CA",4,,Good for ambitious person. Good atmosphere,"Much work, many rules, but ok"
Good,2021-01-16,"Software Engineer in Los Angeles, CA",5,,There are many pros of working at google,There are no cons while at google
Great,2021-01-31,"Data Analyst in Mountain View, CA",4,,"healthcare, compensation, and work-life balance",none i can think of
Good,2021-02-03,"Engineer in San Jose, CA",3,,good pay for the position,some times it gets busy
"Smart folks, good work-life balance",2021-01-12,"Software Engineer in Mountain View, CA",4,,"Benefits, work-life-balance, great development infrastructure",Can compensate less than other competitive Bay Area companies
Great place,2021-01-28,"Software Developer in Mountain View, CA",4,,Great experience and great people,Long hours and very demanding
Amazing Company!!!,2020-12-29,"Recruiter in New York, NY",5,,The best company to work for - periodt.,No cons at all - I feel very valued here.
great place but upward mobility is limited due to size,2020-12-09,"Senior Data Scientist in Mountain View, CA",4,,Great place to start career to learn about best engineering and business practices,Limited upward mobility due to size
Great company,2021-01-13,"Senior Software Engineering Manager in Mountain View, CA",5,,Technical excellence in scaling and reliability,Becoming a very large company
Good company,2021-01-13,"Software Engineer in Mountain View, CA",5,,"Lots of perks, learning resources.",Scope of project can be limited.
BizOps Principal,2021-01-13,"Bizops Principal in San Francisco, CA",5,,Great all round place to work,Getting too large and bureaucratic
Great compny,2021-01-14,"Software Developer in New York, NY",5,,good compny to work for,none that i can think of
WOW,2021-01-06,"Vice President Marketing in Simi Valley, CA",2,,There’s nothing like this place.,Cannot sell this app to advertisers
good company,2021-01-15,"Senior Software Engineer in Mountain View, CA",4,,technical challenges are interesting. stock appreciation.,have cliff after 4 years
Decent company,2021-01-15,"Human Resources Coordinator in Portland, OR",3,,Good pay for team members,No work life balance for team members
Career growth seems limited,2021-01-08,"Software Engineer in Mountain View, CA",4,,Big name and good place to learn,Career growth seems pretty limited
Awesome job,2021-03-14,"Specialist in Palo Alto, CA",1,,Great place to work. Lots of perks,none that comes to mind
Excellent place to work,2020-12-13,"Senior Software Engineer in Pittsburgh, PA",5,,"Smart, friendly, and moral teammates.",Easy to get impostor syndrome
its awesome,2020-12-21,"Chief Engineer in San Jose, CA",5,,super awesome gorgeous riveting excellent super awesome gorgeous riveting excellent,no cons no problems over the top exciting traumatic
Good work environment,2020-12-27,"Senior Software Developer in Palo Alto, CA",4,,"Good work environment, work life balanace",Can be stressful at times
Move slow dead company,2020-11-19,"Software Engineer in Mountain View, CA",3,,Won't get fired. You can work 3 hrs per day.,"Low comp, low impact, move slow, no growth. Highly Not recommended if you want to move fast."
Lovely place,2020-12-22,Programmer Analyst,3,,Great place to work all around,Nothing negative to say at all
NA,2020-12-29,"Staff Software Engineer in Sunnyvale, CA",5,,Great culture and challenging work,Nothing that I can remember really.
Great company,2020-12-10,Associate Product Manager,4,,"amazing brand, good salary, great work/life balance.","becoming too bureaucratic and slow, won't learn much. Join a startup instead"
Review,2020-12-12,"Technician in Houston, TX",5,,"Benefits,pay, flexible schedule and great job.",I have no cons for this job
Job Review,2020-12-27,Design Architect,5,,"-Great perks, pay, hours, etc..",-Difficult to move up very quickly
Google wlb,2020-12-10,"Software Engineer in San Jose, CA",5,,Free food big company good benenfit,Less impact with large group
Pays well but job sucks,2021-01-24,Software Engineer,1,,Good pay and benefits and stuff,Everything else like a bunch of libtard employees
Great,2021-02-27,Vice President,1,,Great yes it was good,Not so bad for this time
A cult..?,2020-11-20,"Software Engineer II in Santa Clara, CA",4,,"Amazing benefits, free food yay","Loss of yourself, overwork, sexism"
Software Engineer,2020-12-08,"Software Engineer in Mountain View, CA",5,,great culture and smart people,work life balance not so good
Google Software Engineer,2020-12-09,"Software Engineer in Cambridge, MA",4,,"great coworkers, perks, amenities, location","big company, tough to get promoted"
Swe review,2020-12-03,"Software Engineer II in Mountain View, CA",4,,Food and lots to learn.,Becoming a typical corporation though adament they are not
It is a great company.,2020-12-03,"Software Engineer in Mountain View, CA",5,,People are very nice overall.,It has too many people.
CEO,2021-02-22,Chief Executive Officer (CEO),1,,free food is a pro in my book,they are a racist company
Good job,2020-12-05,"Software Engineer in San Jose, CA",4,,"Gym, challenging work, high pay","long meetings, difficult work, didn't like my boss"
Excellent place to work,2020-08-19,"APMM in Mountain View, CA",5,,Will keep your network throughout your career. Highly intelligent co-workers.,"Big projects take time, so you have to have patience."
best job period,2020-08-20,"Business Analyst in Seattle, WA",5,,love it best place on the face of the earth,non they are amazing amazing
Great experience here,2021-02-05,"Software Engineer in Menlo Park, CA",4,,"Learnt a lot, great benefits",no cons were felt by me
Great!!,2021-02-06,"Product Manager in Mountain View, CA",4,,Great company culture great co workers,Very political and hard to move up
Great company with comprehensive benefits and opportunity for internal mobility,2021-01-13,"Associate Program Manager in New York, NY",4,,Benefits On-site resources and amenities Good culture (team-dependent),Bureaucracy / workplace politics Poor work / life balance
Great Benefits Rigid Culture,2021-01-30,Account Executive,4,,Amazing benefits and competitive pay,Falling behind on workplace flexibility and promotional pathways
Good,2021-02-08,Anonymous Employee,3,,Pay is good and office is nice,"Very Bad community, long hours"
good stuff,2020-09-05,"CEO-Founder in New York, NY",5,,"The pros can be good, which is awesome","Cons can be bad, so stay away"
Fascinating place to work,2020-08-26,"Principal Systems Engineer/Manager in San Francisco, CA",5,,"Opportunity to work on an innovative, advanced technology. Great teammates. Fantastic boss.",Struggled with the work/life balance.
Great Company to work for,2020-08-27,"Technology Project Manager in Boulder, CO",5,,"Great company, lots of opportunity for movement","Big company, you can feel like just another minon"
Developer,2020-08-30,Senior Software Developer,5,,Pay is great ya dig,Pay needs to get better soon
good,2020-08-30,"Software Engineer in San Francisco, CA",5,,"fantastic work life balance, great management",there are no cons here
