review_title,review_date,review_person,ratings,review_text,review_text_pro,review_text_con
Program Manager,2017-03-13,"Program Manager in Mountain View, CA",5,,"Great Salary, Great Benefits, Free Food! Management really cares; Google really cares about their employees. Interview processes ensure that only the best people are hired.",There really are not many. The company has a start-up mentality so things are always changing. You must be comfortable with constantly changing priorities and reorganization.
Great place to work,2017-05-25,"M&A in San Francisco, CA",5,,"People, perks, salary, benefits. One of the top payers around and lots of flexibility in benefits and work schedule. Have had many great managers","Little room to grow, long hours. Feels very much like a big company now and your contributions can feel insignificant"
Great benefits,2017-07-17,Anonymous Employee,4,,"Creative people, great campus and benefits, and I really love my job. The ability to work on multiple projects at once is highly desirable.","None that I can think of. The commute is long, but that's my problem, not theirs."
Old time Googler,2018-03-06,"Anonymous Employee in Mountain View, CA",4,,"Positive Tech culture still there Benefits, pay and equity Flexible schedule",Starting to ossify with process and rules.  Performance review and promo process is a farce.
"Great teammates, projects, pay, and perks",2018-08-19,"Senior Software Engineer in Seattle, WA",5,,A consequence of the crazy hiring bar is that everyone you work with is very smart and you can rely on your teammates to get things done.,"I guess some of the typical big company stuff, like it sometimes taking longer for a project to complete."
Fulfilling work that matched my skill set,2019-08-07,"Program Manager in Kansas City, MO",4,,Co-workers in local office were great to work with. Work was challenging yet fulfilling. Pay and benefits were very good.,I would still be there had it not been for a change in strategy for particular product line I supported. Limited opportunities in certain areas of the country.
"A place full of good colleagues, good welfare",2020-01-05,"SRE in Los Angeles, CA",5,,", a place that just continues to grow, a place where you can work with pride and work in a relaxed way.","It's a little downside, but it's just getting bigger."
A place of countless possibilities,2020-05-05,"User Experience Designer in San Francisco, CA",5,,Google tries its best to provide growth opportunities. Employees get to connect with mentors and take classes. The work life balance is great so the employees can block out time to learn and grow in ways they desire.,Every team is very different. Understanding the team before going in is very important.
Excellent place to work,2015-10-31,"Senior Software Engineer in Mountain View, CA",5,,"Lots of smart people, challenging work, and flexibility to move around to different teams.",Can be very stressful at first and work/life balance can be difficult (depending on the team).
Best company to work for,2015-11-10,"Business Analyst in Mountain View, CA",5,,Awesome people awesome culture awesome place to work free food,Too much work to do in a time
Great company,2015-11-25,Senior Software Engineer,4,,"Great work-life balance. Very friendly and cooperative colleagues, partly due to the way we hand out promotions. Internally rather transparent and management seems to listen to what we want.","There are many overqualified and hardworking people here. Just hard work alone will not get you anywhere. You need to source for good projects, work hard and smart in order to have decent career advancement."
Great Place to Intern At,2016-09-19,,5,,Treated interns very nicely. The teams were extremely welcoming. The perks were obviously the best part. :D,"The company is really big, so some days can be really slow."
Overall great company,2016-10-17,Anonymous Employee,5,,"Smart coworkers, beautiful offices, great perks","It's a big company - decisions are starting to get made for political reasons, and a few Bs have been hired who now hire Cs"
Great place to work,2016-11-07,"Software Engineer III in Mountain View, CA",4,,"Most people I worked with were very intelligent, friendly, and respectful. Engineers are well-respected, and the tools and processes are world-class. My programming skill has improved very significantly in the year and a half that I was here.","Although it does a good job of cutting down on bureaucracy, Google is not completely free from some problems that affect large companies. Because there are so many brilliant people fighting for projects, politically savvy becomes an important skill. Additionally, occasional shake-ups do mean that some projects get canceled."
Test Engineer,2017-01-11,Anonymous Employee,5,,Great place to work at and I have worked on many companies.,I don't recall any cons. This is really a great place to work at.
"Great culture, great people",2017-02-03,"Engineering Manager in Kirkland, WA",5,,Get to work with some of the best software engineers around.,Increasingly bureaucratic as it gets larger.
Best Company Ever,2017-04-05,"Intern in Los Angeles, CA",5,,Free food Excellent People Good Mentors Great Opportunities Excellent Infrastructure Updated Technology Always Innovating,Too Busy People Inferiority Complex Sometimes you feel you are very alone in this big company Its no longer a startup
Great company,2017-05-13,"Software Engineer in San Bruno, CA",5,,Super flexible working hours Good pay Do as much work as you want and get recognized for as much as you do,"Getting somewhat cumbersome to do some development tasks, due to larger overhead"
Developer,2017-03-22,Anonymous Employee,5,,"Fun enviorment, You learn a lot while you are there",Maybe the work to life balance could be better but overall it was very good
Great Company,2017-03-28,"Anonymous Employee in Mountain View, CA",5,,"I worked with a lot of talented people, which helped raise my own skills.",The hours can be long and the expectations high.
Channels Specialist,2017-04-20,Anonymous Employee,5,,Amazing work-life balance and ability to act autonomously!,Training and onboarding new team members in their line of service; but we're getting better!
"Exciting, difficult, and meaningful work.",2017-05-04,"Senior Security Engineer in Mountain View, CA",5,,"Talented people, hard problems, great environment.","Intense pressure and competition in certain teams. Product plans change quickly, some projects die before completion."
Great place to work,2017-05-16,"Operations Manager in San Francisco, CA",5,,"Flexible working environment, great people, great perks, tons of opportunities across all types of disciplines... hard to get bored.",experience (positive or negative) can vary by manager
Corporate Operations Engineer,2017-05-18,Anonymous Employee,5,,"Great pay, great culture, interesting work","sexism within all male teams and its just accepted, woman advised not to transfer to those teams"
Great Company,2017-07-03,Anonymous Employee,5,,"A lot of trust in individuals to do their job well, interesting projects that can have a huge impact on billions of users.",None that I have run into.
Software Engineer,2017-07-12,"Software Engineer in San Francisco, CA",5,,This was a great company environment to work for.,There were long hours for this job.
Sales strategy & operations,2017-09-19,Anonymous Employee,5,,"Huge revenue impact, unlimited resources if you build your business case","Large company, can feel like a machine requiring sign off at many levels"
Product Specialist,2018-02-02,,5,,Great benefits and super smart people to work with.,As the company gets bigger things start to move a lot slower
Work Place,2014-03-14,,5,,Great place to work! Went there several times and the place is just amazing,None. The place is awesome. No cons to report at this time
Great,2014-06-23,"Software Engineer in Mountain View, CA",5,,Good culture. Wacky HQ. Good Perks,"Bad management, some leaders take things not so seriously"
"Good, Needs Help",2014-07-08,"Software Engineer in Mountain View, CA",4,,The interesting projects and people are a huge pro for me. The salary is extremely good as well. I'm very excited to see the Company's future.,"Work/Life Balance is extremely hard. I don't know why they insist on turning us into slaves. If you have a bad manager, your experience will surely be ruined."
A Challenging and Exciting Time!,2014-08-27,"Anonymous Employee in Mountain View, CA",5,,Having a voice with upper management.,None that I can think of off the top of my head.
"Talented, driven and passionate team environment.",2014-09-17,,4,,"You get to focus on what you do best. Google tries its best to take care of everything else (within reason) so that you can focus on doing what you do best. Little things like: food, transportation, entertainment, and the right tools for the job ( computers, phones, and even desks)","Since it's becoming bigger and bigger, you get the feeling that you're contributions are not making a big impact. Which leads many googlers to leave after 18 months."
Talent Acquisition,2014-09-23,"Senior Recruiter in Mountain View, CA",5,,"Great processes, strong systems, smart hiring managers, excellent employment branding","Vague career path for TA professionals,"
An Intern's perspective,2015-02-16,Intern,5,,"Great office culture, perks, company values, global footprint","promotions, compensation, smaller offices in remote areas, difficult to ignore the free snacks, too much free food"
Life at Google,2015-02-21,,3,,"Interesting projects, many smart people, occasionally interesting people, perks are good, great ability to learn","Many projects don't make money or are a challenge from a go-to-market perspective so it can be very difficult to attract the talent needed for the role, hiring committee is sometimes our own worst enemy, ad revenue is down and it is felt throughout the organization, there are a lot of jerks and everyone has an edge- they may be ok to work with but you aren't going to make friends here"
Senior Software Engineer,2015-04-28,"Senior Software Engineer in Mountain View, CA",5,,"Absolutely great place. Very, very smart co-workers engaged in doing amazing stuff.",You need to be very bright to keep up with your peers.
Lives up to the hype,2015-06-25,Financial Analyst,5,,"Colleagues, culture, resources, perks, benefits","Commute, cost of living in the Bay Area"
Engineering Practicum Intern,2015-10-08,,3,,"It had a fun work environment, and people are amazing.","Was not working on a project I particularly liked, and I saw that it can be difficult to move around in the company"
Awesome and fun place to work at,2016-02-09,"Research Intern in Mountain View, CA",5,,It's Google after all! I had a great time working there and my co-workers were quite supportive.,The workload was quite heavy and sometime I had to work late nights.
Greatest place to work,2016-05-20,Anonymous Employee,5,,"Everything is great. The co-workers, the perks, the food, the benefits, the salary. It's the best place to work.","Every job has bad days, but this place's bad days aren't really that bad."
Senior Product Marketing Manager,2016-07-02,"Senior Product Marketing Manager in Mountain View, CA",4,,"High energy, fast paced. Not competitive. A lot of room to self-direct and work on projects of interest.","No business discipline. Poor senior leadership. Too much of a focus on ""shiny things"" vs. driving revenue."
Software Engineer,2016-09-27,,5,,"Great work place, good benefits and over all nice place to work","Get's really competitive, everyone stays in late due to the food."
Communications Officer,2017-02-01,,3,,Fulfilling work and opportunity to travel and represent your country. Gained important skills and training such as facilitating work shops.,Pay could be better as well as benefits. The work environment also needed an upgrade such as kitchen facilities and work spaces.
Great place to work,2017-02-21,"Technical Program Manager in Mountain View, CA",5,,"Perks on campus and products we get to work on are awesome, but the people are the best part.",Lots of bureaucracy and your experience can vary depending on what organization you are.
"A growing company, but culture changes with new CFO",2017-11-07,"Anonymous Employee in San Francisco, CA",4,,company has many growing opportunities in new products and initiatives,"culture changes with the arrival of new CFO, more cost control, cutting perks and benefits"
Great for new grads,2018-05-22,"Software Engineer in Los Angeles, CA",4,,"Good work environment, great peers. Excellent benefits and compensation.","Walking fine line for promotions, merciless weeding out slow growers. Bad for mothers in terms of life/work balance. Spaces are crammed."
X Internship,2018-07-12,,5,,"Incredible people to work with, meaningful projects, and a lot of room to grow technical skills",can take a long time to feel like you're familiar with internal technical infrastructure
"Lack of Respect, Superficial & Self-Entitled People, Lowest EQ Around Silicon Valley",2015-05-07,"Writing in Mountain View, CA",1,,"Well, you might say that it's the on-site perks that are great, but really it's all an illusion because this company operates like the Borg and expects everyone to come in, conform, and become appendages to each other and the company as a whole. Also, having free food at work is nice, if only they offered heart-healthy, diabetic-friendly options. Too bad the campus isn't in a better location -- like a downtown San Francisco one where you at least had other options within walking distance. You can take the shuttle to work, true, but that keeps you trapped in a confined space for a long period of time with other Googlers. Not a pleasant experience.","Does anyone in management or in the company as a whole have an EQ over 5? Forgot any ideas about equality, respect and cultural sensitivity. Also forget working here if you have anything more than about 5 years of experience -- they'll try to exploit the hell out of you and take advantage of any knowledge or experience that you have that isn't part of your job. And they'll bully and harass you on and off campus if you don't give them what they want. Then again, they bully and harass the local community and the local service workers -- the ones who keep the company running on a daily basis, so why would it be any different for someone over the age of 30 who actually has valuable life experience. Not a recommended place to work for anyone seeking job satisfaction of any kind."
Google's review,2015-06-15,"Senior Software Engineer in Mountain View, CA",5,,"fair, respectful, innovative, talented co-workers, fair pay, good programs","getting too big, slow, hard to get promoted"
I love my job,2015-07-22,Anonymous Employee,5,,Fabulous interior; free food; smart people,A lot of employees; hard to balance life at work and home; average management
Amazing,2015-08-12,Operations Program Manager,5,,Too Many to count. there's a reason they get 3 million resumes a day.,None I can think of
False affordances,2015-08-17,"Software Engineer in Mountain View, CA",2,,Great internal tools Pay is great Other companies will want to pay you lots of money if you worked here because they think it means something,"Supply and demand applies. Everyone's very talented, so the ability to achieve is worthless, those who excel are those who monopolize and hoard scarcer resources. (approvals, visibility) Office politics is 90% of the job."
Good,2015-08-19,"Applications Strategist in San Francisco, CA",5,,Good at bonuses and paying and fun to work their,I do not like the lunch room lol but it is cool
Sr. Account Manager,2015-08-25,,5,,"Great people, Great perks, Great company mission","Large company with lots of bureaucracy, rigid rules when it comes to promotions/pay increases"
Great Experience,2015-09-12,,5,,Interning at Google was an awesome experience overall.,Google definitely has a big company feel and at first can be extremely overwhelming.
Good,2015-09-15,,5,,There a good company and u will love what u do,There are not many Cons in this business so thanks everyone
Amazing Peers,2015-10-10,"Technical Lead/Manager in Mountain View, CA",5,,Amazing people to work with and learn from.,"None that I can think off. Well, maybe a long commute from the city."
A+,2019-12-16,Gpl,5,,-Sharp colleagues -Influencing a critical component of any company's growth plan,"-""Google = Ferrarris competing over parking spaces""... smart people with limited opportunities"
Very useful and very easy to search,2020-02-03,"Software Engineer in America, IL",5,,Genuine for job searchers very happy to use this app,Nothing about cons for this app
Great place to work,2020-02-11,"Hardware Engineering Manager in Mountain View, CA",5,,"Great culture, lots of flexibility, respectful people, free food.","Big company, complex infrastructure, not enough focus on user interface."
an amazing company to work for,2020-03-14,"Staff Software Engineer in Mountain View, CA",5,,an amazing company to work for,switching companies after getting used to all the perks is hard
Awesome Company,2020-04-01,Senior Accountant,5,,"Google is an awesome company to work for, awesome benefits and top talent!",Expect to gain a few extra pounds. :)
Great company to work with...,2020-04-16,"Software Engineer in Mountain View, CA",5,,The best facilities available for any employee.,Great competition to stay at there.
Great Company!,2020-05-11,"Program Manager in Sunnyvale, CA",5,,Amazing people and work life balance,Big company so a little harder to get things done
Amazing,2020-05-14,"Senior Consultant in New York, NY",5,,Google has access to unparalleled resource,"Pressure, deadlines, very stressful work environment"
N/A,2020-06-15,"Senior Technical Support Engineer in Reston, VA",5,,Perks and compensation. Great Challenges,Workload is more and it is sometimes difficult to have work-life balance.
the best company to work for in the world,2008-06-11,"Senior Software Engineer (TL) in Mountain View, CA",5,,"great place to work, great perks, great collegues!",lots of work to do
Critical juncture,2015-07-20,"Anonymous Employee in Mountain View, CA",3,,Smart co-workers; interesting work; fun to be at a high-profile place; perks are good.,"Company needs to make some changes/decisions to avoid becoming Microsoft from years ago (bloated, political, etc)"
Sales Coordinator,2015-07-21,,5,,"Lots of perks, great people, awesome atmosphere, very flexible schedule, learn a lot from others",everyone is really serious about their work.  lots of competition stress sometimes
Awesome Company,2015-09-19,"Software Engineer in Mountain View, CA",5,,Free food amazing perks and overall good pay and benefits and amazing challenges.,Its a big company so its sometimes slow and sometimes very fast paced which can be time consuming
Sales Manager,2015-10-09,"Head of Sales in San Francisco, CA",4,,Great place to work/perks/culture/fun/learning and very smart ambitious people to work with. Great name on your resume,has become very political/career growth is much slower/comp is not great
Great Place for MBAs...If you can hold out on a hiring decision,2015-12-13,MBA Intern,5,,"Lots of autonomy, fun place to work, talented co-workers",Long time for a hiring decision for MBA full-time and intern roles.
Great company,2016-04-04,Account Executive,5,,Terrific place to work especially in the west coast awesome workers and benefits and work environment,I cannot think of any cons I just like how they run things like clockwork
Great Company overall,2016-05-28,"Software Engineer in Mountain View, CA",4,,"- Work with smart people - Challenging problems - Lots of opportunities - Company treats people very well - Nice perks (food, Gyms, transportation ... etc.)",- Big Company Bureaucracy - Lots of legacy to maintain
Great minds and limitless options,2016-06-07,"Product Manager in Mountain View, CA",5,,Experience what good looks like. Everybody is smart around you and goes an extra step to deliver best goods.,It has become big and decision process takes time.
"excellent benefits, frustrating sometimes",2016-07-26,"Senior Software Engineer in Mountain View, CA",5,,Was a great place in terms of benefits and freedom of work,A bit cumbersome now due to its size
Great,2016-08-20,,5,,"Hundreds of fun project, and also hundreds of not so fun projects",Sometimes there was politics instead of just making great products
Product Specialist,2018-02-02,,5,,Great benefits and super smart people to work with.,As the company gets bigger things start to move a lot slower
Fired for Bringing up AI spy bots and mass collection of data on citizens.,2018-03-07,Anonymous Employee,1,,Friendly staff Not much else I can say for pros,"They're spying on you, and I figured out how. I was immediately fired for saying I would expose it."
Wonderful Place to Work,2018-03-19,Anonymous Employee,4,,"Perks like free food, reduced price massages onsite, fun activities/fitness classes Smart & Talented Co-workers Fast paced Opportunities to work on projects outside your role",Constant changes  Career mobility is challenging
So far its ok,2018-05-08,Anonymous Employee,4,,Make your own schedule.,No way of keeping track of how many responses were sent which makes it impossible to keep track of compensation
Short review,2018-05-12,"Product Manager in Mountain View, CA",4,,You'll work with some of the smartest people in the world. Most Googlers are pleasant and very professional.,Large company and things generally move more slowly.
PgM review,2018-05-23,,5,,"Good culture, lots of very smart people to work with and learn from",Lots of sub teams that need input on most projects. This can sometimes slow things down.
Advanced grad school,2018-06-02,"Software Engineer in Mountain View, CA",5,,Learn more than absolutely anywhere as an engineer.,"Very smart and driven engineers are fantastic to learn from, but hard to stand out from."
Analytics Intern,2018-06-27,Anonymous Employee,4,,Very friendly work environment. I was certainly treated well by all other employees.,I felt my opinion was not considered very strongly amongst management. I suppose this could be expected.
Excellent benefits and people,2018-07-17,"Sales Executive in New York, NY",5,,"A lot of talent all around, very inspiring.",Getting too large to operate effectively.
Greatest company of our generation,2018-07-17,"Anonymous Employee in Austin, TX",5,,Terrific mission. Inclusive culture. Great management. Ridiculous benefits and compensation.,Very big so it's sometimes hard to navigate the relationships.
super,2019-08-29,"Data Analyst in San Francisco, CA",5,,i like it so much,very good this company and i like it
Great company!,2019-09-11,Account Manager,5,,"Great environment, training, and benefits.",Not a lot of room to grow.
Amazing Company,2019-09-14,Software Development Engineer,5,,"Company have really good benefit, and it do care about employees.",Sometime the development process is slow
Great place to work,2019-09-21,Senior Product Manager,5,,Great people and teams that can build anything,Sometimes things are slower than you'd like
Strong culture for a large company,2019-10-08,Head of Sales,5,,Company always endeavors to do the right thing.,"It's a large company, period."
Great place to work and grow!,2019-10-14,BizOps,5,,Fast paced and smart people,can be a little slow moving at times
Summer Research Intern,2019-12-10,"Intern in Palo Alto, CA",5,,Great Team Great Work Environment Good Food,Three months is not enough to get a research project done
Great Company,2019-12-12,"Software Engineer(Internship) in New York, NY",5,,People are smart Opportunity to work on a great technologies Nice working conditions,Big company and all that follows
Good Environment,2019-12-18,Engineer,5,,Lots of benefits for employees of company,Work can be slow at times depending on your position
Still a good place to be,2020-02-06,Anonymous Employee,5,,Invests in its people for the long term,Can feel big-company at times
Great company and culture,2014-12-24,"Sales Operations Manager in Mountain View, CA",3,,"Work life balance, amazing talent, treat people really well, comp, benefits - you name it!","Difficult to get promoted, crazy hours in start-up product areas"
Great place to work,2015-01-14,,4,,Everything that can be possibly imagine from a world class company,Out of touch engineers who think yiu should know everything.
Google for Work Sales to Latin America,2015-01-20,"Sales Representative in Mountain View, CA",5,,"Great culture, a lot of learning opportunities","Commute to San Francisco, not a sales organization"
Lots of opportunities,2015-02-28,"Staff Software Engineer in Mountain View, CA",5,,"Great people, hard problems, very competitive salary and the best benefits around.",Can be hard to advance with so many great people around you.
"This place was amazing. Made a ton of money, with free food.",2015-03-04,"Software Engineer In Test in Portland, OR",5,,"The working environment, the pay",The guy I worked with
First rate,2015-03-29,,5,,Definitely the most amazing company on the Earth,You might not be able to make yourself stronger due to your work at Google is fixed
"great work environment, easy to talk to other teams or see what they are doing",2015-04-19,"in Mountain View, CA",5,,"Free food is great, management is flexible.",The business is Ad based
Unclear expectations,2015-05-15,,3,,"Personable people, meticulous organization despite its complexity",Expectations as to training were not made clear at the beginning of the project.
"Perfect, but there is still but",2015-05-25,"Online Marketing Specialist in San Francisco, CA",5,,"renumeration was very satisfying, lots of benefits","location, hard to get there from the city"
Great experience.,2015-07-04,,5,,Everything is as good as they say it is.,"As an intern, it's stressful ramping up to get familiar with all of Google's proprietary technologies."
