review_title,review_date,review_person,ratings,review_text,review_text_pro,review_text_con
FAANGM COMPANY REVIEW,2021-08-23,Anonymous Employee in Hyderābād,5,,Work culture is great with good pay,"Fast paced life, work life balance disbalanced."
Excellent place,2021-08-08,"Sales in London, England",5,,Great technology in many different sectors,No cons applicable to google
5,2021-12-24,"Systems Engineer in London, England",4,,Good to work with Google,Not such cons to be said
"Good money, not the best career wise",2021-11-01,Software Engineer,4,,- money - not a lot of tight deadlines,"- very slow progress in tasks/projects due to the organization size - each team is responsible for a tiny part of the product, reach comfort zone very fast"
Great company,2021-09-02,Data Analyst,5,,Has great work life balance.,Can not think of any.
"Get in, boost your CV, get out. Treat it as 6th year of studies.",2021-04-03,Software Engineer in Zürich,3,,You get 3x more attention from recruiters. Salary in top 10% of employers. Free food.,"Extreme competition among engineers (expect being compared with people doing overtime to get promoted). Substandard designers, managers are just promoted engineers (so ""manage yourself, I want to code""), custom tech for everything (so most of stuff you learn there you will never use again). Also you feel like playing a game: rules are highly artificial, people are ""mastering strategies"" to get ahead, nobody really cares about product. When you get in, learn the rules from someone who works there for 4+ years, and don't trust common sense."
Great company,2021-07-27,"Business Development Consultant in London, England",5,,"great benefits, hugely supportive and friendly",big organisation and sometimes input can feel limited. Not necessarily a negative though.
good,2021-07-28,Senior Consultant in Tokyo,5,,It is a workplace with a high degree of freedom.,Not suitable for people who are too free and lazy.
Great workplace,2021-08-10,Anonymous Employee,5,,Best working environment amongst all,Overworking issues pertain case to case basis
Great company,2021-08-12,Tax in Singapore,5,,Good benefits with great community,Segmented responsibilities due to the size
good,2021-07-16,Software Developer in Hyderābād,5,,it is a hell of a ride to work and enjoy at the same time.,no cons are there as per my atmosphere is considered.
The best company,2021-07-24,Anonymous Employee,5,,"Super smart people, great culture",big company and very structure also lower than startup
Awesome Company,2021-08-04,Software Engineer in Bangalore,5,,Everything and anything is awesome,Nothing Nothing Nothing Nothing Nothing
best place to work,2021-08-08,Anonymous Employee,5,,"good job, good food take care",not much to cmplain about
Best company,2021-08-09,"Software Engineer in Nāgpur, Maharashtra",5,,Best company to work with,No cons at all so
Excellent place to work,2021-06-08,"Associate Account Strategist in Dublin, Dublin",5,,"Amazing teams, products, people and support",High turnover in the Dublin office and lack of career opportunities outside the starting division
Salary,2021-11-10,Software Developer in Cape Town,4,,Bonus medical aid Transport allowance Meals provided Vacation,Intense Long hours no salary review no visitor bonus once every 3 years
Great apprenticeship scheme,2021-07-19,"Digital Marketing Apprentice in London, England",5,,"Good managers, opportunities and great company",Not guaranteed a full time role
Na,2021-07-21,Customer Service Representative in Hyderābād,5,,Have good management and employee benefits,I dont think of any Cons
Nice,2021-07-25,Test Analyst,5,,Good Company Nice  Environment work culture,No Negative services facilities better
Healthy Environment,2021-11-07,Software Engineer in Indore,4,,On-time project allotment to members,No uniform as formal wear
DevSecOps,2021-06-30,Cyber Security Engineer in Kosovo Polje,5,,burpsuite sqli linux api django,I have done plenty of penetration tests alone with fully understanding documentation report of bugs.
software developer,2021-07-12,Anonymous Employee,5,,good company good salary . hello . how . what,"nothing at all , best company"
Great,2021-07-19,Anonymous Employee,5,,Amazing benefits great culture and job,None that i can currently think of
Great company,2021-07-20,"Lab Technician in Dublin, Dublin",5,,The Experience is really great,No major cons that come to mind
Pretty cool,2021-07-06,Junior Software Developer in Bangalore,5,,Very Very Very Very good,Sometimes Sometimes Sometimes Sometimes bad
Good people,2021-07-07,"Environmental Consultant in Auckland, Auckland",5,,Good people and great place,Commute is a bit long
Ok,2021-07-08,Anonymous Employee,5,,Its ok to work here,Sometimes the people are to smart
nice,2021-04-27,Anonymous Employee,5,,"The triangular() method returns a random floating number between the two specified numbers (both included), but you can also specify a third parameter, the mode parameter.","The mode parameter defaults to the midpoint between the two other parameter values, which will not weigh the possible"
Great place!,2021-10-24,"Junior Software Developer in London, England",4,,Amazing people! Great benefits and nice place to work!,Some pressure and deadlines but its okay
Great culture and place to work,2021-06-21,Computer Vision Engineer,5,,Many opportunities. A lot to learn,Challenging and need to develop skill set continuously
Good company,2021-11-06,Software Engineer,3,,Free lunch and free drinks,No work-life balance at all
Magical Place to work,2021-06-25,Software Development Engineer I in Hyderābād,5,,"Top class peers, best talent, amazing work environment","too much competetion, hectic work schedule"
Very good,2021-06-25,"Software Development Engineer (SDE) in Gurgaon, Haryana",5,,Its awesome to work very great culture. Lot to learn,No cons of working at Google
Well paid but boring,2021-03-18,SRE Engineer in Zürich,5,,"- High stock bonus - Frequent monetary rewards for doing your job well and just because: ~$5000-$10000 per year - Lots of vacation days for SREs as oncall compensation - Perks: long maternity/paternity leave, cheap massages in the office, free gym, free headphones, free food...","- Relatively boring job - Relatively low base salary - Personal projects, personal responsibility for them. Very little team work."
Great place,2021-06-17,Senior PMM,5,,Good colleagues Lots of freedom Deep thinking,Slower growth than before Can get too comfortable
manager,2021-06-20,Anonymous Employee,5,,it was professional it was great,it was too crowded and overwhelming
Excellent Company,2021-06-21,Customer Service Representative in Bangalore,5,,Good colleagues to work with,Very good work environment around
The best company to work for,2021-10-14,Anonymous Employee in Madrid,2,,High salary and good teamates,"Long working hours, on weekdays"
Ok but too googly,2021-10-12,Head Of Operations,2,,Food and lots of it,People were a little weird
nice,2021-06-16,Anonymous Employee,5,,nice place to earn a living,no cons to comment at this time
Account Manager,2021-05-28,Anonymous Employee,5,,It's really just an amazing company to work for,its a big company so there is no room for huge impact
As you would expect,2021-05-29,Managing Director in Jumayrah,5,,Great environment and team. I have learned a lot.,"None, the location may be bit far from residential areas."
Still top company to work for,2021-04-29,"Software Engineer in Waterloo, ON",5,,Great office culture. Great people around you. Plenty of different opportunities. Major impact on technology world. Scale of the projects is immense.,Work from home removes one of the best benefits - office access.
Good,2021-10-22,"Engineer in London, England",2,,Good place to work. Great perks.,Nothing really. Things get done.
sd,2021-07-16,Software Developer,3,,confident ds ds sd sd,no good dd dd fg hjt r
boom,2021-08-04,Intern in Seoul,1,,close to home nice cowerkers nice interior nice environmentclose to home nice cowerkers nice interior nice environment,minimum pay minimum pay minimum pay minimum pay minimum pay minimum pay minimum pay minimum pay
Data Analyst in Google,2021-06-24,Data Anlysts in New Delhi,4,,Good environment Parking facility Good food and staff good managment,Timing issues location in India Transporting is expensive
It's good,2021-06-26,Anonymous Employee in Hyderābād,4,,All is good. Please send me the details regarding this message.,No cons My order today and commissioning of AC drives.
Good place to learn new things rapidly,2021-07-03,Design Engineer in Chennai,3,,get to know the current wireless concepts,work pressure is quite high
Good work place,2021-07-05,Anonymous Employee,4,,Amazing learning curve and good work place,Little hectic at times specially during deadlines
Go for it,2021-07-11,Analyst in Mumbai,5,,Excellent fantastic go for it,Nothing just go for it
Good,2021-07-13,"Civil Engineer in Colombo, Western",5,,Good Good Good Good Good,No consNo consNo consNo consNo cons
Decent,2021-07-15,"Senior Software Engineer in Dublin, Dublin",4,,"Good pay, nice campus, smart people","Longer hours, Longer commute (traffic)"
It's dream company of mine and i eagerly want to join the google,2021-06-15,Python Developer in Bangalore,5,,It gives good salary to their employees.,Nothing to write about cons.
Good,2021-06-28,Administrative Assistant in Singapore,5,,Good company to work in,No cons great company to work for
Good,2021-07-01,Online Training Manager in Mumbai,5,,The company is very good,There are no cons here
Great,2021-07-02,"Senior Human Resources Manager in Dublin, Dublin",5,,Very Supportive work environment there,Very Busy work environment there
Nice,2021-07-02,Software Engineer in Ahmedabad,5,,Everything is good in google,None...no cons as of now
Great people and benefits,2021-01-20,"Account Manager in Dublin, Dublin",4,,"- people - office  - benefits (food, massages, gym, swimming pool) - stock options - easy to change between the teams / roles","- with work from home, most of the benefits faded away and the company loses its spirit - salary not that competitive compared to other companies that Googlers could work for - very slow promotions progress"
Love the company,2021-04-26,Regional Program Manager in Bangalore,5,,- Flexibility  - Impact of work - Scale of projects,"Nothing really! If I were to nitpick, we still operate in US timezones for global meetings - Work life can take a hit sometimes with Global calls happening in the evening"
Fantastic,2021-06-21,Anonymous Employee,5,,great work culture and great peer group,low scope for innovation and inflated CTC estimates
If you are considering a TVC role with Google,2021-02-26,"Anonymous Employee in Beijing, Beijing",4,,Get a chance to work in a big org and build personal connection,"Won't recommend for people who have 5+ yrs of exp. There is minimum space to develop and the chance of conversion is low. Additionally, if you get converted within 2 years, the total comp is not that competitive but your package is 2 yrs behind the market rate."
Great place to work,2021-06-23,Anonymous Employee,5,,Lots of benefits and great teams,I had a long commute
One of the best places to work at,2021-06-04,"Product Manager in London, England",5,,Great colleagues and development opportunities,Despite the start-up feel decisions are taken in an enterprise manner
Its Google...name is enough,2021-05-22,Software Developer in Hyderābād,5,,Top tech company with all the benefits you can think of...,"Im all happy, not a word to say"
Not Bad,2021-06-13,Software Development Engineer (SDE) II,5,,Brand Tag Nice Pay and Perks,None that I can think of
World best company,2021-06-13,Software Engineer in Hyderābād,5,,World best company for career,No cons for this company
"Great place to work, but difficult to succeed",2021-03-14,Software Engineer L4 in Zürich,4,,"Nice compensation and benefits, very smart people around.","Everyone around is overqualified for the job they do, so your have to try twice as hard to make impact and stand out. Interesting tasks are often taken by more senior engineers."
Great,2021-06-16,Anonymous Employee,5,,Intelligent workforce with great rewards.,Office politics harbour productivity sometimes.
Great,2021-06-16,"Network Administrator in Toronto, ON",5,,All Every good Excellent ah,Any Nothing nada absolutamente great
good,2021-06-17,Anonymous Employee,5,,best company good salary  good team,no cons salary comes in time
H,2021-06-17,Software Engineer,4,,Good one actually not a problem,nothing bad not actually problematic
Top Notch Benefits,2021-05-28,Trust and Safety Specialist,5,,"Free food, perks, travel, internal mobility",Too big and bureaucratic at times
Best,2021-06-18,Anonymous Employee,4,,Very very very nice company,Send you abroad too often
Really good,2021-05-27,Anonymous Employee,4,,Good management and good salary,hectic work sometimes you have to do overtime
Google Customer Engineer,2021-05-13,Customer Engineer in Singapore,5,,high salary and wonderful working environment,I do not have any bad memory working in this wonderful company
Good,2021-06-01,"Junior Data Analyst in São Paulo, São Paulo",5,,It's a great work place,You have to work REALLY hard.
As iam fresher so it's good opportunity to build my carrier in google,2021-03-07,MBA Marketing in Mysore,5,,It's a good flat form to show case my talents to your organisation,"high work pressure ,Mental works stability"
Good culture but low salary,2021-05-16,"Software Engineer (Swe II) in Kitchener, ON",4,,Culture is very good no blame policy,Canadian salary is low compared to other US companies
Great Company,2021-05-03,"Senior Sales Manager in Bedok New Town,",5,,People first mentality - for the most part,Becoming like other legacy large tech company. Slow and lethargic
Cool spot,2021-05-22,"Anonymous Employee in Canan, Abra",4,,"Cool, dope, awesome, neat, interesting f",You know I’m not sure what to put here
awesome,2021-05-08,C Programmer in Dhanbād,5,,i am happy with your company,thank you for give me this job!
Great Culture,2021-04-14,Partnerships in Sydney,5,,"Great people & culture, fast paced and solving interesting problems!",The company gets bigger everyday and shares the same challenges as other large companies with burgeoning middle management and complex org structures
Nice place!!,2021-04-27,Software Test Engineer in Bhilai,4,,it was good place to start carrier and also will gain good knowledge,Everything is good but somehow increases beak timings
Awesome place to start your career,2021-04-17,Account Strategist in Seoul,5,,"Great compensation, lots of learnings",Lots of operational works especially if you are a junior
Nice environment,2021-05-14,Software Developer in South West,5,,Very Nice environment to work,Cannot think of any cons
Best company to work for,2021-05-02,Anonymous Employee,5,,Company with the right values and put people first,it's a really great company
nothing,2021-05-17,Software Engineer in Ahmedabad,4,,its a very good experience,the data privacy is not secured
Great company - bad location,2021-02-11,Program Manager,4,,"Working at Google it's probably one of the best companies one can work for in terms of colleagues, resources and learning curve.",Working for Google in Dublin it is not great as the city lacks offer and opportunities and the EMEA HQ is not diverse enough in terms of management levels.
Nie,2021-05-21,Software Engineer in New Delhi,4,,None all good fine happy,happy nice great enjoyed lovely
Awesome,2021-05-14,Software Engineer,5,,Just the best place to work,there is nothing musch to say
Great place to work,2021-02-17,Senior Software Engineer in Tel Aviv-Yafo,5,,"Very supportive, room for personal growth and bring your own ideas to work. Generally great people, highly skilled pros around","It's a corporate, with everything that goes with it. For me personally it's a bit of a con."
manager,2021-05-16,"Project Manager in London, England",5,,nice working environment and good salaries,very nice working environment around
Good place,2021-05-20,Anonymous Employee,3,,Nice good best money work,Nothing no nada nana nah
Yes,2021-04-20,"Armed Security Guard in Burlington, ON",5,,I loved working here it was great,Peeper pork kfc was okay
Excellent place to grow,2021-04-22,Anonymous Employee,5,,You will work under excellent environment,No cons is noticeable to me
Great company,2021-04-23,Software Engineer in Vadodara,5,,Great business practices lol yeah,Im just writing this so I can use glassdoor
Great,2021-04-26,Computer Engineer in Amman,5,,Challenging positive provoking supportive fun,"Long , tough , exhausting, tiring , moderate"
nice place,2021-04-28,"Marketing Associate in Toronto, ON",4,,good team with good benefits,bad pay and not enough time off
Not that good,2021-04-30,Software Developer,3,,Challenging projects and good technical support,People are way too anxious
good school board,2021-04-19,"Anonymous Employee in Toronto, ON",5,,they have amazing communication and are very kind,none that i can think of
Plenty of challanges,2021-04-22,Senior SRE in Zürich,5,,Very smart colleagues and lots of learning oportunities,Company moving slower and slower
Great place to work,2021-01-20,Programmatic Account Strategist in Hyderābād,4,,"Great work culture, great atmosphere, food is great and you learn lots. The people are wonderful.","Your actual experience at work comes down to what kind of a manager you have and if you're unlucky, your life can be really tough. Also the competition is very tough, so its quite hard to get promoted."
Smart folks everywhere,2021-07-05,Software Engineer,1,,"Smart folks everywhere, High scale","Moves as slow as snail, Slow growth"
Great company,2021-04-22,Web Developer in Hyderābād,3,,the team are so nice,they pay your salary late
Interesting company,2021-04-23,Anonymous Employee,2,,some smart people working there,Management could be a bit better
Great learning experience,2021-04-13,"Intern in London, England",5,,Got to muck in and learn.,None I can think of.
good,2021-04-14,Anonymous Employee,5,,good and very good. It was all good,"nothing to find any errors,"
Nothing,2021-04-14,"Senior Analytical Lead in Gurgaon, Haryana",5,,Very good company to work for,No cons as such for Google
Sales,2021-04-16,Sales Associate,3,,Commission is good for top sales execs,"Old school mentality, cold call driven"
"Good perks and benefits, careers opportunities and growth",2021-03-24,Anonymous Employee,4,,"Best people in the business, international environment, well being","Entitled people, becoming more bureaucratic over time"
Great company to work for,2021-02-07,"Account Manager in Dublin, Dublin",5,,- The possiblity of working with and learning from multiple interesting clients/companies.  - Learn a great a deal about online marketing - Great salary and benefits - Fun and genuine collegues,Internal politics are important if you wish to progess
Great place,2021-04-07,"Program Coordinator in London, England",5,,- Free food  - Great collaborative opportunities  - Incredible people,- TVCs can be restricted
my job my life,2021-04-08,Engineer SoftwareEngineering - G4 in Bangalore,5,,i love my job in google india,nothing to say about conclusion
google,2021-03-29,Student Ambassador in Yanbu‘ al Baḩr,5,,A successful company has all the capabilities,There are no Cons to this company
"collaborative, supportive",2021-03-30,Program Manager,4,,"team spirit, opportunities to try new things",can feel hard to make a difference
Nice place,2021-03-31,Analyst in New Delhi,4,,Very good culture and nice workplace,Workload is high and package is high
About good experience,2021-04-01,Technical Support Engineer in Hyderābād,4,,Best place to work in this company,Nothing to say for cons
review for good.,2021-04-01,Anonymous Employee,4,,company rewards its employees nicely.,much to take care about its business.
Good company if you like being held in place,2021-03-25,"Client Services Administrator in Milton Keynes, England",2,,Good company to work for,Long hours are common place
Its an excellent company to work with,2020-12-19,Software Engineer in Bangalore,5,,The company genuinely takes care of its employee and try to ensure their maximum productivity even in adverse condition.,"Because there is a framework to help with everything like dependency injection, database management etc. You might not learn the entire stack if Google is your first employer."
good company,2021-03-26,Computer Programmer in Singapore,5,,many benefits and compensations. lively work environment,no cons as company spirit is good
good,2021-04-07,Senior Software Development Engineer,4,,good best ever comany culture,not find at all any cons
Great experience,2021-04-02,"Sales Operations in Dublin, Dublin",5,,Great place to work overall!,Complacency can tend to build up
"Great place to work, but difficult shift to large corporate",2021-04-05,"Principal Analytical Lead in London, England",4,,"Interesting projects, good promotion prospects, great people to work with.","Lack of autonomy, Switch to large corporation is slowing things down."
Excellent work life balance,2021-04-29,Anonymous Employee,4,,"Excellent remuneration, and work life balance",A really high performing organization and with high expectations from their employees. Self marketing ability is a celebrated attribute more than anything else. Promotions are hard.
All is very good,2021-01-16,"Graphic Designer in Cali, Valle del Cauca",5,,"Money, people, director, gifts, money","Very hard work, less time for my self"
Great place,2021-01-11,"Software Engineer in Calgary, AB",5,,Learn cool stuff Smart coworkers Best place for an SWE,High pressure environment Can get stressful at times
About the job,2021-01-27,Analyst in Hyderābād,5,,Friendly atmosphere pressure less job,Completing of targets in given amount of time
Good company,2021-06-08,Programmer,4,,Good salary and lot of employees benefits and discounts,It can be exhausting at times
Best place to work in,2021-01-20,Executive Director in Singapore,5,,I get really rich and I love it,Nothing bad to say about it
Best company i ever work at,2021-01-13,"BDR Representative in Dublin, Dublin",5,,"culture, atmosphere, mobility, good mission",Lack of direction in the google business. too competitive. slow promotion
Best Company,2021-01-28,"Business Development in Dublin, Dublin",5,,Progression work/life balance  Training Managers listen t you,There is none There is none There is none
Good,2021-06-19,Data Analytics,4,,The company offers stimulating environment,Competition can sometimes be stressful
Good and steady,2021-01-13,"Growth Manager in Dublin, Dublin",5,,"Great place to work, easy hours, great pay",Occasional politics and some misalignments
good,2021-01-14,Assistant Manager in Indore,5,,Good company t work in google,Bad for ineterney jsn jahid jdh dnh jd jd
Good company,2021-01-23,Anonymous Employee,5,,Good benefits and decent salary,Some red tapes and bureaucracy
Amazing place to work,2021-01-09,"Software Engineer in London, England",5,,Great technology exposure and great team,Sometimes gets hectic and work life unbalanced
Great place to work,2021-05-30,Anonymous Employee,4,,Great culture and supportive seniors,Nothing that I can think of
Sales Associate,2021-06-02,Sales Associate,3,,Great benefits and I enjoyed my time there,None that stand out really
Good,2021-01-18,Sales Associate in Noida,5,,Good Morning good morning and happy,Companies are doing good with me today
Google is the best Software Company to work for..,2020-12-28,Anonymous Employee,5,,Google is the best Software Company to work for..,Nothing I can think of..
hello,2021-06-08,Head Of Human Resources,3,,like a warm family generally,we are busy all day generally
Best Place to work!,2021-01-13,"Account Manager in Dublin, Dublin",5,,"Talented colleagues, Great atmosphere, Caring of well being",No cons for me about Google
It's okay,2021-05-17,Anonymous Employee,3,,"There are actually more timings, culture and friendly staff",Nothing to say about cons
Good,2021-05-20,Software Development Engineer I in Pune,4,,Its pleasures to work with infosys,There is no cons of infosys
Great inclusive culture,2020-12-23,Software Engineer in Singapore,5,,Work on meaningful projects with top talents,Mostly the same as a standard software engineer's woes
Nice,2021-05-23,Project Manager in Kraków,4,,Big society and good experience,Too much work but it's ok
Good company to work for,2021-04-28,"Chief Financial Officer (CFO) in London, England",4,,Coworkers are nice and willing to support,Long hours but it’s only bcs you enjoy what u are doing
Superb,2021-01-08,Project Manager in New Delhi,5,,They are having really great staff,I haven’t experienced them yet
Just amazing to work at Google,2020-11-28,"Software Engineer(Internship) in London, England",5,,"It is Google, takes care of the employee in every possible way.",I can't think of any. (None)
Demanding,2021-03-25,"Agency Development Manager in Dublin, Dublin",3,,Most intelligent people you can meet in your career,"Wellbeing doesn't exist. You work, work and work. And when you don't work, you think about the work."
campany name as in HYD as pandora R & D labs,2021-06-01,QA Software Engineer in Hyderābād,1,,work is too high 3 member work can be given to single person,"company will not follow the timing here no value for testing , blindly believe dev team only"
Good place,2021-05-16,Anonymous Employee,4,,Good place to start your career,The company is moving into murky waters
A very enthusiastic company with short career and well being,2021-04-17,Anonymous Employee,4,,Good hard working enthusiast patience,Bad anger lazy not good
Review @ Google,2021-04-29,"Engineering Manager in Kitchener, ON",4,,"Good benefits, environment and salary",Too much bureaucracy and red tape
Intern dev,2021-05-01,"Anonymous Employee in Waterloo, ON",4,,Good career growth and opportunity.,Nothing that comes to my mind.
