review_title,review_date,review_person,ratings,review_text,review_text_pro,review_text_con
Cloud gtm,2023-04-30,"GTM Strategy in Washington, DC",5,,"Great benefits, good work like balance, good manager","Lots of change, systems lacking at times, leadership turnover"
"Moving at the speed of light, burn out is inevitable",2013-06-21,"Program Manager in Mountain View, CA",4,,"1) Food, food, food. 15+ cafes on main campus (MTV) alone. Mini-kitchens, snacks, drinks, free breakfast/lunch/dinner, all day, errr'day.  2) Benefits/perks. Free 24:7 gym access (on MTV campus). Free (self service) laundry (washer/dryer) available. Bowling alley. Volley ball pit. Custom-built and exclusive employee use only outdoor sport park (MTV). Free health/fitness assessments. Dog-friendly. Etc. etc. etc.  3) Compensation. In ~2010 or 2011, Google updated its compensation packages so that they were more competitive.   4) For the size of the organization (30K+), it has remained relatively innovative, nimble, and fast-paced and open with communication but, that is definitely changing (for the worse).  5) With so many departments, focus areas, and products, *in theory*, you should have plenty of opportunity to grow your career (horizontally or vertically). In practice, not true.   6) You get to work with some of the brightest, most innovative and hard-working/diligent minds in the industry. There's a ""con"" to that, too (see below).","1) Work/life balance. What balance? All those perks and benefits are an illusion. They keep you at work and they help you to be more productive. I've never met anybody at Google who actually time off on weekends or on vacations. You may not hear management say, ""You have to work on weekends/vacations"" but, they set the culture by doing so - and it inevitably trickles down. I don't know if Google inadvertently hires the work-a-holics or if they create work-a-holics in us. Regardless, I have seen way too many of the following: marriages fall apart, colleagues choosing work and projects over family, colleagues getting physically sick and ill because of stress, colleagues crying while at work because of the stress, colleagues shooting out emails at midnight, 1am, 2am, 3am. It is absolutely ridiculous and something needs to change.  2) Poor management. I think the issue is that, a majority of people love Google because they get to work on interesting technical problems - and these are the people that see little value in learning how to develop emotional intelligence. Perhaps they enjoy technical problems because people are too ""difficult."" People are promoted into management positions - not because they actually know how to lead/manage, but because they happen to be smart or because there is no other path to grow into. So there is a layer of intelligent individuals who are horrible managers and leaders. Yet, there is no value system to actually do anything about that because ""emotional intelligence"" or ""adaptive leadership"" are not taken seriously.  3) Jerks. Sure, there are a lot of brilliant people - but, sadly, there are also a lot of jerks (and, many times, they are one and the same). Years ago, that wasn't the case. I don't know if the pool of candidates is getting smaller, or maybe all the folks with great personalities cashed out and left, or maybe people are getting burned out and it's wearing on their personality and patience. I've heard stories of managers straight-up cussing out their employees and intimidating/scaring their employees into compliance.  4) It's a giant company now and, inevitably, it has become slower moving and is now layered with process and bureaucracy. So many political battles, empire building, territory grabbing. Google says, ""Don't be evil."" But, that practice doesn't seem to be put into place when it comes to internal practices. :("
"Great balance between big-company security and fun, fast-moving projects",2014-05-10,"Software Engineer III in New York, NY",5,,"* If you're a software engineer, you're among the kings of the hill at Google. It's an engineer-driven company without a doubt (that *is* changing, but it's still very engineer-focused). * The perks are amazing. Yes, free breakfast, lunch, an dinner every weekday. Aaaaaamazing holiday parties (at Waldorf Astoria, NY Public Library, MoMA, etc.); overnight ski trips to Vermont; overnight nature trips to the Poconos in the summer; summer picnics at Chelsea piers; and on and on and on. I don't see this going away unless the company starts hurting financially. * Speaking of which, the company is doing quite well, which reflects in bonuses and equity grants. * There a huge diversity of work ranging from defending independent journalism worldwide (Google Project Shield) to crisis response during disasters (see Maps during Hurricane Sandy or Tsunamis), to the best machine learning experts and projects in the world, to more mundane revenue-driving projects in advertising, there's really something for everybody. * It's easy to move around within the company as long as you're in good standing (the vast majority of engineers are). * The company is amazingly open: every week Larry Page and Sergey Brin host what's called TGIF where food, beer, wine, etc. is served, a new project is presented, and afterward there's an open forum to ask the executives anything you want. It's truly fair game to ask anything, no matter how controversial, and frequently the executives will be responsive. * No, nobody cares if you use an iPhone, Facebook, shop with Amazon, stream using Spotify, or refuse to use Google+. The company is amazingly open and flexible.  Neither pro nor con, but general information on work-life balance, promotions, and advancement. * Work life balance can be what you want it to be on most teams. (Some teams are in more competitive sectors and require more crazy hours all the time - but very few of them). If you do what's expected, you'll be fine at least for a handful of years. Working a roughly 40 hour work week is possible, and many people do it. There are also people who are hyper-motived and work like crazy just because they love it, or because they're competitive, or they want to get a promotion. If you work 40 hour weeks without putting in anything extra, you'll fall behind them as they advance and you stand still - and maybe that doesn't matter, so it works out for everybody. But at least know where you would realistically stand. * If you excel and work your butt off, you'll be compensated and promoted. If you let yourself be a code monkey, and just sit coding with your head down all day, you'll be fine but won't advance. A big complaint from some Googlers is about not being able to advance ""even at Google"" with pure coding. Sure, if you're the uber genius who created MapReduce and Bigtable, you're going to advance like a rocket without having to do anything but coding; but if you're like most engineers at Google -- smarter than average, but just average compared to other Googlers -- you're just a good coder and not revolutionary. Code monkeys are important to actually get stuff done, and to be sure you absolutely need to be a good coder as a software engineer (it's the minimum requirement), but code monkeys won't advance because they're not leaders and they're easy to replace. To get promoted you need to lead and do more than just code. There are plenty of ways to lead other than being an official tech lead, so this isn't actually _that_ hard, so the real point is just that you can't just sit there coding what other people tell you to code all day and expect to advance.","* It *is* becoming larger, and with it comes growing pains: bureaucracy, slow to respond to market threats, bloated teams, cross-divisional tension (though nothing remotely approaching that of Microsoft's internal tension). * The quality of the engineers is possibly dropping, but possibly not. It's hard to get real metrics, because as the absolute number of people grows, naturally the number of bad apples grows; as a percentage it's supposedly the same as it ever was, but with larger numbers of poorer quality engineers it just _feels_ like things might be changing for the worse. * Also with growth means more internal-confidential data leaks (again, because of the raw numbers of people) -- product announcements being ruined, etc. That means the company has to be tighter-lipped internally to avoid leaks, which makes things less open. It's still an amazingly open place, but less so than it was even a couple years ago. The good thing is they recognize it and actively look to improve things because they know how important it is to keep the good culture."
The best place I've worked and also the most demanding.,2015-02-08,"in Mountain View, CA",5,,"You can't find a more well-regarded company that actually deserves the hype it gets.  You'll work on cutting edge projects / solve important issues that impact your community and the world  You'll meet interesting people who are your colleagues, managers, and senior management.  You'll open the paper and see your company in the news almost every day, and read about projects you're working on, which is a cool thing  You'll see Larry and Sergey at TGIF and you'll admire how they lead the company. They are brilliant, goofy, low key but intense, and likeable.   There are 22 cafes (more or less), the food is excellent, and it's free.  Your pay will typically be competitive, though it needs to be tweaked up a bit since the economy has improved.  Google cares about how it treats its employees.  The campus is like an academic campus in many ways.  There are tons of activities on campus, like authors speaking about their books, films after work, and gyms where you can work out - but you'll need to make sure to carve out time to do these things.  You'll get plenty of external validation from people who suddenly think you're smart and rich because you work there, even if you're not rich and you're as smart when you didn't work at Google.  If and when you leave, you'll never regret having that company on your resume. It opens doors.   The company is flexible - if you're lucky, you won't have a micromanager boss and you can be somewhat flexible in how you work - but don't get me wrong - you'll work a LOT. But you don't have to do all of it chained to your desk.","I live in SF so the commute can take between 1.5 hours to 1.75 hours each way on the shuttle - sometimes 2 hours each way on a busy day or rainy day. That means being on the bus for 3-4 hours PER DAY. It's a wired bus though which means you can work on the way to Mountain View. But it can feel brutal.  Your first year or two are really important in terms of your career at Google and they affect how you're viewed, and your ability to be promoted. You should always ask to work on high profile projects. If you don't get them, don't expect to get high ratings or get promoted. Always volunteer for cross functional group work for maximum exposure, and then work hard at those things.  You'll likely work on something that no one will explain to you and it will take you at least a year to be comfortable doing what you're working on, even if you're super quick at learning. No one has time to train you or teach you what you're doing - which is kind of hard.  After two or three years, people you started out with at Google start to get promoted. If you're not one of them, you'll wonder why and how it happened, and that process is somewhat political and not always clear.   It's a big company now. And super political. So don't be naive. Expect some people to be catty, some people to be territorial, and be prepared to be mentally tough. Don't let people see your vulnerableness. It's a Darwinistic culture with a huge dose of 30-something idealism on top which can fool you into thinking that people are easygoing - they're not. They're driven. If you're not driven, you're not going to fit in.  When you start at Google, it seems like peer reviews are super important - they are, but they are the sprinkles on the fro yo. The important thing is that your direct manager knows your work, likes your work and likes you, and then you can get promoted. If your boss doesn't like you, all the positive peer reviews in the world won't help you. Make sure you know what your boss wants, and give it to them. You will have weekly one on ones, and make sure you are addressing your performance at each one, asking if they have questions, how you can improve, can you work on cross functional projects, etc.  It's really hard to find work life balance at Google. The workload is huge. I hardly have time to work out. The commute is brutal. My family sometimes needs more from me and I can't give it. I'm still trying to find the balance. I think I need more down time than most people so I have a hard time being structured every day to fit all the things I want into my day, so a lot of things slip, like working out."
Working at Google,2023-04-25,"Mid Market Account Executive in New York, NY",3,,"Superb benefits, including full 401k match, excellent health and dental care + the famous office perks Google is a company that needs no introduction, and as an employee, I can attest that it is a rewarding, if strange, place to work. On the one hand, the benefits are as great as you would expect from a tech giant like Google. In addition, the overall work environment is positive, as colleagues are generally friendly, supportive, motivated, and intelligent.","The job itself can be a strange one. A lot of time is spent creating work for yourself, as opposed to actually doing the work necessary to grow clients. Google, especially GBO, is very overstaffed, which leads to a lot of weird gamesmanship to try to get promoted. This includes making up weird groups, pointless sales initiatives, taking credit for things that just happen as opposed to being the result of actual effort on the part of the sales staff. As a result, people are rewarded not necessarily for their ability to sell, but for how well they can play the corporate game at Google. In other words, how well they are able to present themselves to management as the ideal Google employee, as opposed to actually being effective at selling."
Fall of a great company culture,2023-02-25,"Android Engineer in Seattle, WA",3,,"I've been at Google a long time, so the financial benefits still outweigh any cons. The people I work with are still mostly great, especially most of my management chain (though one or two are no-ops).","The company was founded on psychological safety, don't be evil, hire smart creatives, etc.. Today, the company has grown so fast and so large that now the majority of people seem to be typical tech industry employees. That means most of the management has now come from outside the company, so that has killed the culture. Psychological safety is gone, especially after the way the layoffs were handled. I miss Laszlo Bock; he knew how to treat the workforce. I miss Larry, Sergey, and Eric. The general quality of my peers has gone down. Not as people, they're all lovely, but as practitioners. Most of them do what we'd have considered low-quality work 5 years ago. It's shockingly bad, really, by comparison. They've all been hired so fast and in such an environment where they weren't properly trained or didn't have the proper background to begin with or haven't been given the time and mentorship required to become great (investing in people)."
Great place to learn how to survive in a corporate environment but needs some work,2023-04-07,"GBO in Detroit, MI",4,,"- Great salary, benefits and equity - Amenities are wonderful, when you can use them - Great people, your peers are truly folks that care - Visibility, I knew what was happening for Google as a company through frequent e-mails from our CEO. - Ability to grow many skillsets that are transferrable outside of Google.","- Hard to get work accomplished cross functionally, misaligned OKRs - Too many priorities make it confusing for your Googlers to truly understand what is important (this would be a few things not 10 + smaller ones). This is burning your team out. - Develop your leaders, teach skillsets that help them to be even more successful in their current role and in developing their teams - When talking about stress management and mindfulness, build it into your work not just in an even tone a year. - Create more vision for your organization, not just the revenue goals but the purpose of the team and where we are going in a way that aligns to the human impact not just the revenue impact"
Can you please provide more context or details?,2023-04-02,"Account Manager in New York, NY",5,,"Innovative and Collaborative Culture: Google's culture values creativity, innovation, and teamwork, which means you'll be working with talented individuals who are passionate about their work. Perks and Benefits: Google offers amazing perks and benefits to its employees, such as free meals, on-site fitness centers, and comprehensive health insurance. Career Development Opportunities: Google invests in its employees' career development by providing opportunities for professional growth and learning, such as training programs, mentorship, and career coaching.","employees may feel pressure to constantly perform at a high level to meet company expectations. Long Hours: Some positions at Google may require long hours and tight deadlines, which could impact work-life balance. Bureaucracy: Google is a large company with a complex organizational structure, which may lead to bureaucratic processes and slow decision-making. Limited Career Advancement: While Google does offer many opportunities for professional growth, some employees may find that career advancement is limited due to the highly competitive nature of the company."
"Financial health up, mental health down",2023-03-27,Director of Customer Success,3,,"The benefits and financial stability and growth I enjoyed over my years at Google helped me avoid so much financial anxiety faced by my peers, and I know how lucky I was to have them.","The culture is in rapid decline. There is rampant use of corporate speak, and Googlers who can't read between the lines effectively suffer constant performance anxiety. There is a lot of talk about roles having clear objectives that prevent bias, but in practice there is plenty of subjectivity, and the Googlers that succeed are those that devote their energies to internal upward management. You are told constantly that it's a different sort of company - and you are expected to agree - in spite of so much evidence to the contrary."
Very manager dependent,2023-04-12,"Program Manager in New York, NY",1,,- Legacy of good values - Some older Googlers are great and foster a good culture,"- Very very manager driven environment - Lack of understanding of direction and strategy. Try and fail fast mentality leads to many issues as the company's scale can no longer support such an attitude - Entreprenuerial to an extent that there is very little support as you are new to the firm. This organization is a monster of its own to navigate - unlike any in the industry. Without the nature of guidance that initial googlers could access because of smaller scale, many nooglers struggle - Touts as being OKR driven but at a closer look you can see that there is intense data manipulation and storyline projection to show that they met OKRs. OKRs are often shifted - sometimes at the end of the review cycle - contrary to public image, they prefer only aggressive type As and it is sometimes upsetting to see the level of politics that exists - There is no diversity w.r.t personality types. If you are in with the cool crowd - you are in. Else you will struggle."
Great Company,2023-04-20,"Senior Software Engineer in San Francisco, CA",5,,"Benefits, WLB, Offices, Salary, Food",Achieving significant influence or making a notable difference can be challenging in a company of such size
Medicore,2023-04-24,"Telecommunications Engineer in Mountain View, CA",2,,There are a lot of amenities on site.,Lack of direction and organization.
Good,2023-04-22,"Senior Software Engineer in San Antonio, TX",3,,Good stuff It was quite fun I enjoyed it,None whatsoever it was a great experience and I enjoyed it.
good place to work,2023-04-22,Senior Engineer,5,,good place to work overall,less salary than other company
Great place to work,2023-04-19,Software Engineer (Swe II),5,,"Lots of different things to work on. Relaxed culture, depending on the team.",Individualistic performance structure sometimes leads to lack of collaboration.
Good Corporate Company,2023-04-21,"Software Engineer in Venice, CA",4,,Good people to work with,Most of the perks are gone. Promotion opportunities are more difficult to come by now.
"Great opportunity, but be wary of the hype",2023-03-13,Software Engineer,4,,Top-notch engineering. Just being around other skilled engineers and seeing how things are done causes you to become more skilled. Friendly people. Lots of small perks,"Inconsistent product direction. There's a lot of internal joking about the short time between teams being shuffled, and this means it's difficult to see projects through to completion. Senior leadership seems more focused on cost-cutting than effective long-term vision. There's lots of talk about respecting each other, but when the chips are down leadership does not follow through on that."
Great Company,2023-04-18,"Senior Account Manager in New York, NY",5,,Best company I've ever worked for!,Not a lot of upward mobility because it is lean at the top. But that's what's great about a big company!
Learning a lot,2023-04-19,Software Engineer in Dallas-Fort Worth,5,,"Learning a lot, making a lot, solving really hard problems, working with fantastic people",Slow and complex process as most big companies
Not what it used to be,2023-02-08,"Sr. UX Manager in San Francisco, CA",2,,"Really amazing coworkers who are experts in everything you can imagine, and generally really kind and helpful. Great total compensation.","I was shocked by Google's inability to get stuff done, and how toxic the culture is around performance reviews; the GRAD system is unbelievably half-baked and the rollout was beyond inept. People were also constantly stressed about basically everything, and one coworker told me when I started that everyone was in a state of organizational misery, all the time, and that it was just part of the Google experience. Yikes."
"Overall, Great!",2023-03-29,Data Analyst Intern,5,,I learned a lot from this cross-function team.,"Some time feel tired of learning and working, but worth it,"
It,2023-04-01,"Software Engineer in San Francisco, CA",5,,Very good company to work at,I don’t have any cons to say
Professional tram,2023-03-28,"Internship in Seattle, WA",5,,Being surronded by super talented people makes lots of learning oppurtunity.,Job instability is becoming an industrial standard
Work at Google X - The moonshot factory is good.,2023-03-07,"Test Engineer in Mountain View, CA",5,,* No boundaries for the scope of work. * Opportunity to work with the like minded people. * Work environment is friendly. * People are passionate about the work.,No safety for the job. Poor leadership that leads to project closure/shutdown. Switching to other projects (in other bets) is challenging.
Great,2023-04-01,"Business Development Manager in Sussex Unit, WY",5,,Best place to wrk period,No cons that I can think of
Toxic,2023-04-22,UX Design Manager,2,,Generous compensation. Working with highly intelligent people.,Competitive and toxic culture. Incompetent managers.
"Great experience, great people, leverages individuals, little beaucracy",2023-01-19,Senior Technical Program Manager,5,,"- Google does an amazing job of trusting its employees and letting them try new things. - Good ideas can come from anywhere - as long as you have good reasoning for an idea, leadership is open to adopting it. - Very little politics. Even as a program manager, I spent very little time navigating the politics of the organization. - Strong engineering belief in doing things the right way. We rarely cut corners and when we did, we had good justifications for it. - Many options to transfer within the company. (obviously, only if you're doing well at your current job)","- It's getting large. Any organization with over 100,000 people inherits some form of bureaucracy and burdensome processes."
flexible company,2023-04-19,"Administrative Assistant in Atlanta, GA",4,,"great relationship, flexible hours throughout the day","no off days, something can happen at any moment that you need to do"
Review,2023-03-16,Principal Consultant,5,,"Great work life balance, Generous pay and amazing perks.",Currently going through an organizational culture change which is killing it’s kind and collaborative style and giving birth to an up or out culture that reflects the toxic cultures of other companies.
Good place to work,2023-04-19,"Junior Software Developer in San Jose, CA",4,,"Good pay, good benefits and flexible timing",Annoying working with all those entited brats there
good,2023-04-02,Technical Support Engineer,3,,"good culture, work life balance","less pay, hectic work life balance"
Review,2023-03-16,Principal Consultant,5,,"Great work life balance, Generous pay and amazing perks.",Currently going through an organizational culture change which is killing it’s kind and collaborative style and giving birth to an up or out culture that reflects the toxic cultures of other companies.
Very good pay,2023-03-25,"Senior Financial Analyst in Kirkland, WA",3,,Pay and benefits are top of market but that’s about it,"Extremely political, toxic middle management, forced RTO in finance, long hours and lots of evenings"
